id,name,last_price,unit_size,last_update
12987,Pintalabios mate 12h Lasting Lips Deliplus 01 rosa nude,5.0,1.0,2025-11-25 07:36:09
12988,Pintalabios mate 12h Lasting Lips Deliplus 02 beige nude,5.0,1.0,2025-11-25 07:36:10
12989,Pintalabios mate 12h Lasting Lips Deliplus 03 medio marrón,5.0,1.0,2025-11-25 07:36:10
12990,Pintalabios mate 12h Lasting Lips Deliplus 04 rosa medio,5.0,1.0,2025-11-25 07:36:10
12992,Pintalabios mate 12h Lasting Lips Deliplus 05 rosa pétalo,5.0,1.0,2025-11-25 07:36:10
12993,Pintalabios mate 12h Lasting Lips Deliplus 06 malva,5.0,1.0,2025-11-25 07:36:11
12994,Pintalabios mate 12h Lasting Lips Deliplus 07 fucsia,5.0,1.0,2025-11-25 07:36:11
12995,Pintalabios mate 12h Lasting Lips Deliplus 08 rojo,5.0,1.0,2025-11-25 07:36:11
23540,Pintalabios mate Deliplus 101 nude,4.5,0.004,2025-11-25 07:36:06
23541,Pintalabios Mate Deliplus 102 caramelo,4.5,0.004,2025-11-25 07:36:06
60929,Pintalabios Mate Deliplus 107 caldera,4.5,0.004,2025-11-25 07:36:06
60933,Pintalabios Mate Deliplus 111 marrón,4.5,0.004,2025-11-25 07:36:06
8303,Pintalabios Mate Deliplus 114 rosa medio,4.5,0.004,2025-11-25 07:36:07
8301,Pintalabios Mate Deliplus 116 rojo intenso,4.5,0.004,2025-11-25 07:36:07
78071,Pinza de cejas Deliplus oblicua,2.0,1.0,2025-11-25 07:30:34
78073,Pinza de cejas Deliplus recta,2.0,1.0,2025-11-25 07:30:35
9900,Pinzas de ropa Bosque Verde,1.5,24.0,2025-11-25 07:35:27
15967,Piparra Hacendado,2.8,0.29,2025-11-25 07:20:40
34095,Pipas calabaza tostadas Hacendado aguasal,1.55,0.125,2025-11-25 07:20:52
34188,Pipas de calabaza natural Hacendado peladas,1.7,0.15,2025-11-25 07:20:48
34145,Pipas de girasol fritas Hacendado peladas,1.1,0.2,2025-11-25 07:20:49
34043,Pipas girasol barbacoa Hacendado,1.35,0.2,2025-11-25 07:20:50
34193,Pipas girasol naturales Hacendado peladas,1.24,0.2,2025-11-25 07:20:51
23059,Pipas girasol tostadas Hacendado 0% sal añadida,1.3,0.2,2025-11-25 07:20:52
34078,Pipas girasol tostadas Hacendado gigante aguasal,1.2,0.2,2025-11-25 07:20:44
34079,Pipas girasol tostadas Hacendado gigante con sal,1.2,0.2,2025-11-25 07:20:43
22249,Piquitos bajos en sal Hacendado con orégano y tomillo,1.23,0.25,2025-11-25 07:38:48
82222,Piquitos con salvado San Roque,0.9,0.142,2025-11-25 07:38:49
52455,Piruleta de chocolate con leche Hacendado Navidad,1.7,0.035,2025-11-25 07:22:04
34262,Pistacho natural Hacendado pelado,2.75,0.1,2025-11-25 07:20:53
86190,Pistacho tostado Hacendado 0% sal añadida,3.65,0.25,2025-11-25 07:20:43
86202,Pistacho tostado Hacendado con sal,3.65,0.25,2025-11-25 07:20:42
35653,Pisto de verduras Hacendado ultracongelado,2.1,0.45,2025-11-25 07:28:20
63628,Pizza 4 quesos familiar Hacendado,3.4,0.58,2025-11-25 07:39:10
63580,Pizza 4 quesos Hacendado,2.9,0.41,2025-11-25 07:39:10
63592,Pizza 4 quesos Hacendado,2.9,0.42,2025-11-25 07:39:10
63623,Pizza 4 quesos sin gluten y sin lactosa Hacendado ultracongelada,3.1,0.41,2025-11-25 07:39:17
63643,Pizza Americana Hacendado ultracongelada,3.5,0.54,2025-11-25 07:39:17
63501,Pizza atún Hacendado ultracongelada,2.6,0.39,2025-11-25 07:39:16
63582,Pizza atún y bacón Hacendado,2.9,0.415,2025-11-25 07:39:12
56647,Pizza atún y bacón Hacendado,2.9,0.44,2025-11-25 07:39:12
63629,Pizza barbacoa familiar Hacendado,3.4,0.6,2025-11-25 07:39:09
63613,Pizza barbacoa Hacendado,2.5,0.415,2025-11-25 07:39:09
60685,Pizza barbacoa Hacendado,2.9,0.44,2025-11-25 07:39:10
63559,Pizza boloñesa Hacendado ultracongelada,2.6,0.4,2025-11-25 07:39:16
22549,Pizza Calzone con jamón cocido y queso Hacendado,3.5,0.4,2025-11-25 07:39:14
63632,Pizza carbonara familiar Hacendado,3.4,0.6,2025-11-25 07:39:11
63653,Pizza carbonara Hacendado,2.9,0.43,2025-11-25 07:39:11
12083,Pizza carnívora Hacendado,3.4,0.6,2025-11-25 07:39:15
67947,Pizza Formaggi Hacendado 4 quesos,3.9,0.4,2025-11-25 07:39:15
14246,Pizza Frankfurt Hacendado,2.9,0.42,2025-11-25 07:39:15
63627,Pizza jamón y queso familiar Hacendado,3.4,0.6,2025-11-25 07:39:09
63581,Pizza jamón y queso Hacendado,2.5,0.415,2025-11-25 07:39:08
63593,Pizza jamón y queso Hacendado,2.9,0.44,2025-11-25 07:39:09
63514,Pizza jamón y queso sin gluten y sin lactosa Hacendado,3.2,0.42,2025-11-25 07:39:13
63585,Pizza margarita Hacendado,2.2,0.34,2025-11-25 07:39:13
63340,Pizza masa fina 4 quesos Hacendado ultracongelada,2.5,0.39,2025-11-25 07:39:16
22649,Pizza masa fina Barbacoa Hacendado ultracongelada,2.5,0.39,2025-11-25 07:39:17
63339,Pizza masa fina jamón Hacendado ultracongelada,2.5,0.4,2025-11-25 07:39:16
22648,Pizza Pepperoni barbacoa Hacendado ultracongelada,3.5,0.54,2025-11-25 07:39:16
63556,Pizza pepperoni Hacendado,2.9,0.41,2025-11-25 07:39:12
63529,Pizza pollo Hacendado,2.9,0.43,2025-11-25 07:39:13
63645,Pizza pollo y bacón Hacendado,2.9,0.42,2025-11-25 07:39:14
22343,Pizza Prosciutto Hacendado jamón y queso,3.9,0.4,2025-11-25 07:39:14
63503,Pizza romana Hacendado con champiñones salteados,2.9,0.43,2025-11-25 07:39:13
63551,Pizza serrana Hacendado,2.9,0.4,2025-11-25 07:39:11
13943,"Pizza Truffata con queso, champiñones y trufa Hacendado ultracongelada",2.9,0.4,2025-11-25 07:39:18
63597,Pizzas tomate y queso Hacendado ultracongeladas,2.4,0.57,2025-11-25 07:39:15
3076,Piña,3.9,2.0,2025-11-25 07:32:33
33440,Piña deshidratada Hacendado,1.35,0.05,2025-11-25 07:21:10
15203,Piña en su jugo Hacendado rodajas,2.5,0.681,2025-11-25 07:28:45
15220,Piña en su jugo Hacendado rodajas,2.1,0.822,2025-11-25 07:28:45
3024,Piña natural a rodajas,3.48,0.58,2025-11-25 07:32:33
60869,Piñones Hacendado,3.02,0.07,2025-11-25 07:19:17
86843,Piñones Hacendado,5.9,0.15,2025-11-25 07:19:18
52889,Placas para canelones El Pavo,1.35,0.125,2025-11-25 07:21:37
6856,Placas para lasaña precocidas El Pavo,1.65,0.2,2025-11-25 07:21:37
44404,Planchado fácil Bosque Verde,2.2,0.75,2025-11-25 07:34:02
22634,Plato decoración poinsettia Navidad Bosque Verde,2.8,10.0,2025-11-25 07:35:09
23187,Plato llano biodegradable Bosque Verde,1.6,15.0,2025-11-25 07:35:05
23188,Plato postre biodegradable Bosque Verde,1.45,15.0,2025-11-25 07:35:05
22635,Plato postre decorado Navidad Bosque Verde,2.55,10.0,2025-11-25 07:35:09
22633,Plato rojo Navidad Bosque Verde,2.8,10.0,2025-11-25 07:35:08
8999,Plumero atrapa polvo Bosque Verde,2.0,1.0,2025-11-25 07:35:29
71586,Plumero de avestruz extensible Bosque Verde,4.95,1.0,2025-11-25 07:35:28
3819,Plátano de Canarias IGP,0.49,0.17,2025-11-25 07:32:24
3132,Plátano macho,0.81,0.28,2025-11-25 07:32:25
13237,Poke salmón,5.5,0.4,2025-11-25 07:39:06
56084,Pollo 97% relleno La Carloteña asado al horno lonchas,2.4,0.15,2025-11-25 07:25:57
8958,Pollo adobado y verduras,3.17,0.46,2025-11-25 07:24:42
4498,Pollo al curry Hacendado con arroz basmati,2.85,0.28,2025-11-25 07:39:24
13706,Pollo asado Hacendado,6.88,1.25,2025-11-25 07:39:25
13707,Pollo asado troceado Hacendado,8.06,1.25,2025-11-25 07:39:26
2782,Pollo certificado entero alimentado con un 50% de maíz,9.25,1.85,2025-11-25 07:24:38
4267,Pollo churrasco,4.31,0.98,2025-11-25 07:24:40
2781,Pollo entero,6.65,1.9,2025-11-25 07:24:36
60306,Pollo marinado rebozado Crispy American Style Hacendado ultracongelado,4.9,0.5,2025-11-25 07:28:00
13236,Pollo teriyaki,5.0,0.3,2025-11-25 07:39:04
52974,Polvo Compacto 24H Long Lasting Deliplus 02 beige rosado,6.0,0.01,2025-11-25 07:35:50
52975,Polvo Compacto 24H Long Lasting Deliplus 03 dorado,6.0,0.01,2025-11-25 07:35:50
52976,Polvo Compacto 24H Long Lasting Deliplus 04 dorado oscuro,6.0,0.01,2025-11-25 07:35:50
8315,Polvo Compacto 24H Long Lasting Deliplus 05 bronceado,6.0,0.01,2025-11-25 07:35:51
80427,Polvo compacto Matificante Deliplus,5.4,0.009,2025-11-25 07:35:49
13026,Polvo compacto perfeccionador efecto seda Deliplus 100 beige claro,6.0,0.01,2025-11-25 07:35:51
13029,Polvo compacto perfeccionador efecto seda Deliplus 200 beige rosado,6.0,0.01,2025-11-25 07:35:51
13030,Polvo compacto perfeccionador efecto seda Deliplus 210 almendra,6.0,0.01,2025-11-25 07:35:52
13033,Polvo compacto perfeccionador efecto seda Deliplus 300 cappuccino,6.0,0.01,2025-11-25 07:35:52
80433,Polvo compacto Sol Deliplus claro,7.5,0.022,2025-11-25 07:35:49
80434,Polvo compacto Sol Deliplus oscuro,7.5,0.022,2025-11-25 07:35:49
80428,Polvo suelto Translúcido Deliplus 01,5.5,0.005,2025-11-25 07:35:50
85649,Polvoroncito de chocolate La Muralla,0.21,0.035,2025-11-25 07:38:00
85708,Polvorón de almendra La Muralla,0.24,0.04,2025-11-25 07:38:00
35595,Polvos de talco Deliplus,1.8,0.2,2025-11-25 07:22:43
11933,Polvos voluminizador para el cabello Volum Fix Deliplus mate fijación 4,3.95,0.01,2025-11-25 07:29:53
79344,Pomada del pañal sin perfume Deliplus,2.75,0.1,2025-11-25 07:22:41
3202,Pomelo,0.89,0.3,2025-11-25 07:32:31
62049,Porciones de bacalao sin piel MareDeus ultracongeladas,6.4,,2025-11-25 07:36:42
12495,Porciones de Chocolate negro 72% cacao extrafino Hacendado,3.65,0.2,2025-11-25 07:21:50
12493,Porciones de Chocolate negro 85% cacao extrafino Hacendado,3.8,0.2,2025-11-25 07:21:52
87200,Porciones de merluza,8.44,0.313,2025-11-19 19:50:50
87240,Porciones de merluza del Cabo,9.1,0.35,2025-11-25 07:36:59
62103,Porciones de merluza del Cabo sin piel Hacendado ultracongeladas,4.9,,2025-11-25 07:36:42
87181,Porciones de rape negro sin piel descongelado,15.2,0.38,2025-11-25 07:37:06
15137,Porras Hacendado congeladas,2.0,0.24,2025-11-25 07:28:10
71055,Posavajillas Bosque Verde,1.35,1.0,2025-11-25 07:34:06
52564,Postre 3 chocolates Hacendado,2.95,0.18,2025-11-25 07:39:56
19947,Postre Capricho Hacendado de yema de huevo,1.7,1.2,2025-11-25 07:39:58
14275,Postre caramelo salado Hacendado,2.95,0.18,2025-11-25 07:39:58
22981,Postre de coco Natural Alpro,2.55,0.35,2025-11-25 07:40:00
15086,Postre de manzana Jamar,1.9,0.71,2025-11-25 07:28:47
20200,Postre de soja Hacendado natural,1.2,0.4,2025-11-25 07:40:00
35466,Postre de soja Hacendado sabor chocolate,1.55,0.4,2025-11-25 07:39:59
13446,Postre de soja Hacendado sabor vainilla,1.55,0.4,2025-11-25 07:39:59
8179,Postre de soja sabor arándanos Alpro,2.25,0.4,2025-11-25 07:40:00
13917,Postre de soja sabor lima limón Alpro,2.25,0.4,2025-11-25 07:40:00
21369,Postre de soja sabor mango Alpro sin azúcares añadidos,2.55,0.4,2025-11-25 07:39:59
52513,Postre de soja sabor Natural con coco Alpro,2.25,0.4,2025-11-25 07:39:59
21073,Postre lácteo con arándanos +Proteínas Hacendado 0% m.g 10 g proteínas,1.55,0.48,2025-11-25 07:40:02
20996,Postre lácteo con fresa +Proteínas Hacendado 0% m.g 10 g proteínas,1.55,0.48,2025-11-25 07:40:01
86087,Postre lácteo con fruta Hacendado 0% m.g 0% sin azúcares añadidos,2.0,1.0,2025-11-25 07:40:02
21151,Postre lácteo con puré mango y maracuya +Proteínas Hacendado 0% m.g 10 g proteínas,1.55,0.48,2025-11-25 07:40:04
20830,Postre lácteo cremoso natural edulcorado Hacendado 0% m.g 0% sin azúcares añadidos,1.4,0.75,2025-11-25 07:40:01
22444,Postre lácteo infantil de cereales y miel Hacendado +12 meses,0.95,0.1,2025-11-25 07:40:24
22442,Postre lácteo infantil de fresa y plátano Hacendado +8 meses,0.95,0.1,2025-11-25 07:40:23
60400,Postre lácteo infantil de galleta Hacendado +8 meses,0.95,0.1,2025-11-25 07:40:24
21256,Postre lácteo natural +Proteínas Hacendado 0% m.g 10 g proteínas,1.4,0.5,2025-11-25 07:40:04
20908,Postre lácteo natural +Proteínas Hacendado 0% m.g 12 g proteínas,1.4,0.48,2025-11-25 07:40:04
52855,Postre lácteo sabor coco +Proteínas Hacendado 0% m.g 10 g proteínas,1.55,0.48,2025-11-25 07:40:04
20849,Postre lácteo sin lactosa cremoso natural azucarado Hacendado,1.55,0.5,2025-11-25 07:40:18
20164,Postre lácteo sin lactosa natural Hacendado 0% m.g 0% azúcares añadidos,1.35,0.5,2025-11-25 07:40:03
22799,Postre lácteo sin lactosa sabor fresa Hacendado,1.45,0.5,2025-11-25 07:40:22
35940,Povidona yodada 10% Deliplus,2.15,0.125,2025-11-25 07:32:18
40258,Prebase corrector Primer Deliplus 02 tono melocotón,5.5,0.025,2025-11-25 07:35:42
15747,Prebase de maquillaje matificante Primer,5.5,0.025,2025-11-25 07:35:41
14922,Prebase facial Primer Terra Deliplus jade,7.0,0.026,2025-11-25 07:35:44
20749,Prebase facial Radiance Primer Celestial Night Deliplus con microcápsulas perladas,7.5,0.02,2025-11-25 07:35:44
22932,Preparado crujiente Hacendado,1.6,0.4,2025-11-25 07:38:43
2867,Preparado de carne picada cerdo,2.85,0.5,2025-11-25 07:25:08
14343,Preparado de carne picada cerdo sabor chorizo,3.85,0.5,2025-11-25 07:25:10
35774,Preparado de carne picada pollo,3.95,0.5,2025-11-25 07:25:10
2868,Preparado de carne picada vacuno,5.5,0.5,2025-11-25 07:25:08
3454,Preparado de carne picada vacuno,10.8,1.0,2025-11-25 07:25:08
52776,Preparado de carne picada vacuno,5.35,0.4,2025-11-25 07:25:09
2869,Preparado de carne picada vacuno y cerdo,4.3,0.5,2025-11-25 07:25:07
3453,Preparado de carne picada vacuno y cerdo,8.4,1.0,2025-11-25 07:25:08
62048,Preparado de paella y sopa Hacendado ultracongelado,4.1,,2025-11-25 07:36:29
69387,Preparado de verdura para cocido,2.15,1.0,2025-11-25 07:33:05
69433,Preparado de verduras para sofreír cortado y lavado,2.4,0.4,2025-11-25 07:33:08
32358,Preparado en polvo cuajada azucarada Royal sabor lácteo,1.45,0.048,2025-11-25 07:38:11
32045,Preparado en polvo flan Hacendado,1.4,0.19,2025-11-25 07:38:12
32002,Preparado en polvo flan Royal,1.8,0.186,2025-11-25 07:38:11
32030,Preparado en polvo flanes y natillas Maizena Potax,1.75,0.192,2025-11-25 07:38:12
32369,Preparado en polvo gelatina arándano Hacendado 0% azúcar,2.0,0.031,2025-11-25 07:38:13
32361,Preparado en polvo gelatina fresa Hacendado,1.5,0.17,2025-11-25 07:38:13
11601,Preparado en polvo instantáneo para crepes Hacendado,2.0,0.17,2025-11-25 07:38:15
32329,Preparado en polvo natillas Hacendado,1.4,0.089,2025-11-25 07:38:13
9054,Preparado lácteo cereales al cacao Peques 3 Puleva,2.0,0.6,2025-11-25 07:33:42
9190,Preparado lácteo con cacao y cereales Hacendado +1 año,2.3,1.2,2025-11-25 07:33:43
9398,Preparado lácteo con cereales crecimiento Hacendado +1 año,9.6,6.0,2025-11-25 07:33:42
9397,Preparado lácteo con cereales crecimiento Hacendado +1 año,1.6,1.0,2025-11-25 07:33:43
9057,Preparado lácteo con cereales crecimiento Peques 3 Puleva,11.94,6.0,2025-11-25 07:33:41
9034,Preparado lácteo con cereales crecimiento Peques 3 Puleva,1.99,1.0,2025-11-25 07:33:42
9187,Preparado lácteo crecimiento Hacendado +1 año,8.4,6.0,2025-11-25 07:33:42
9188,Preparado lácteo crecimiento Hacendado +1 año,1.4,1.0,2025-11-25 07:33:42
9049,Preparado lácteo crecimiento Peques 3 Puleva,11.94,6.0,2025-11-25 07:33:41
9040,Preparado lácteo crecimiento Peques 3 Puleva,1.99,1.0,2025-11-25 07:33:41
19726,Preparado para ahumar Hacendado,3.3,0.75,2025-11-25 07:19:06
23646,Preparado para pizzas Hacendado,1.45,1.0,2025-11-25 07:38:08
29017,Preparado para repostería con impulsor incorporado Hacendado,1.05,1.0,2025-11-25 07:38:07
80292,Preparado para repostería y panificación Hacendado,2.7,1.0,2025-11-25 07:38:09
5840,Presa de bellota ibérica La Hacienda del Ibérico,29.4,0.49,2025-11-25 07:26:28
4915,Presa de cerdo ibérico,8.91,0.33,2025-11-25 07:24:53
77427,Preservativos natural Durex,7.25,1.0,2025-11-25 07:32:24
11606,Preservativos natural On,3.0,1.0,2025-11-25 07:32:23
11607,Preservativos sensitive On,3.2,1.0,2025-11-25 07:32:24
77441,Preservativos sensitivo suave Durex,8.25,1.0,2025-11-25 07:32:23
47377,Protector cama tamaño 60 x 90 cm Deliplus,8.5,1.0,2025-11-25 07:31:27
40413,Protector labial Deliplus FPS 15,1.5,1.0,2025-11-25 07:32:09
60608,Protector solar infantil pediátrico Sun Med FPS 50+,7.5,0.25,2025-11-25 07:32:09
44317,Protector térmico cabello Termo Protect Deliplus,3.0,0.2,2025-11-25 07:29:51
22712,Protectores para los oídos de espuma Moldex,1.7,1.0,2025-11-25 07:32:21
47554,Protegeslip Cotton flexiform Carefree regular + tanga,1.7,1.0,2025-11-25 07:31:21
47480,Protegeslip de incontinencia Deliplus pequeño,3.1,1.0,2025-11-25 07:31:22
47350,Protegeslip maxi Deliplus Cotton,1.8,1.0,2025-11-25 07:31:23
47352,Protegeslip maxi Deliplus Dry,2.5,1.0,2025-11-25 07:31:23
47387,Protegeslip maxi Deliplus Suave,2.25,1.0,2025-11-25 07:31:20
47390,Protegeslip micro Deliplus Fresh,2.0,1.0,2025-11-25 07:31:22
47349,Protegeslip normal Deliplus Cotton,1.7,1.0,2025-11-25 07:31:23
47351,Protegeslip normal Deliplus Dry,2.1,1.0,2025-11-25 07:31:22
47385,Protegeslip normal Deliplus Suave,1.85,1.0,2025-11-25 07:31:20
13954,Protegeslip normal Evax,3.5,1.0,2025-11-25 07:31:20
47386,Protegeslip normal plegado Deliplus Suave,1.1,1.0,2025-11-25 07:31:21
47392,Protegeslip tanga Deliplus Fresh,1.25,1.0,2025-11-25 07:31:22
47391,Protegeslip ultrafino Deliplus Fresh,1.25,1.0,2025-11-25 07:31:21
47389,Protegeslip y compresa 2 en 1 Deliplus Suave,1.65,1.0,2025-11-25 07:31:20
9790,Pudding sabor café +Proteínas Hacendado 12 g proteínas,1.95,0.48,2025-11-20 19:56:58
69411,Puerros,2.52,0.9,2025-11-25 07:33:03
68408,Puerros,2.16,0.45,2025-11-25 07:33:04
24208,Pulpo crudo Hacendado congelado,17.95,1.0,2025-11-25 07:36:50
24291,Puntilla de la Índia Hacendado congelada,4.7,,2025-11-25 07:36:50
23264,Puré de patatas Hacendado en copos,2.0,0.5,2025-11-25 07:28:51
50929,Queso Arzúa-Ulloa de vaca Punteiro,7.33,0.78,2025-11-25 07:26:48
51627,Queso azul de vaca Hacendado,2.45,0.18,2025-11-25 07:27:14
50959,Queso añejo de oveja al romero Hacendado,5.18,0.27,2025-11-25 07:26:48
50975,Queso añejo fuerte de oveja Hacendado,6.04,0.33,2025-11-25 07:26:47
5548,Queso añejo ibérico mezcla Hacendado cortado en cuñitas,6.08,0.32,2025-11-25 07:26:50
50972,Queso añejo picante mezcla Hacendado,4.43,0.25,2025-11-11 07:28:32
50973,Queso añejo seco de oveja Hacendado,4.01,0.23,2025-11-25 07:26:49
50952,Queso añejo tostado mezcla Hacendado,6.19,0.37,2025-11-25 07:26:49
5522,Queso blando mezcla Hacendado,2.24,0.14,2025-11-25 07:27:16
50619,Queso brie marcillat de vaca Plaisir de Roy,1.75,0.2,2025-11-25 07:27:15
51621,Queso camembert de vaca Marcillat,2.0,0.24,2025-11-25 07:27:14
51630,Queso curado cheddar Hacendado,3.3,0.3,2025-11-25 07:26:48
19865,Queso curado de oveja con jalapeño Hacendado,5.54,0.26,2025-11-25 07:26:51
50589,Queso curado DOP manchego de oveja Hacendado,5.43,0.27,2025-11-25 07:26:48
11682,Queso curado mezcla afrutado Hacendado cortado en cuñitas,4.83,0.33,2025-11-25 07:26:51
4883,Queso curado mezcla con trufa Hacendado,6.04,0.27,2025-11-25 07:26:50
50968,Queso curado mezcla Hacendado,18.06,1.63,2025-11-25 07:26:44
50965,Queso curado mezcla Hacendado,4.67,0.41,2025-11-25 07:26:45
50967,Queso curado mezcla Hacendado,12.31,1.09,2025-11-25 07:26:45
50966,Queso curado mezcla Hacendado cortado en cuñitas,4.69,0.33,2025-11-25 07:26:44
50994,Queso curado mezcla madurado en madera Hacendado,3.87,0.26,2025-11-25 07:26:50
51111,Queso curado y cheddar Hacendado en dados,1.15,0.125,2025-11-25 07:26:46
19862,Queso de cabra Montesinos,2.35,0.2,2025-11-25 07:27:17
23561,Queso emmental de vaca Hacendado,3.0,0.35,2025-11-25 07:26:53
51151,Queso en polvo especial pasta mezcla Hacendado,1.3,0.15,2025-11-25 07:27:01
51146,Queso en polvo grana padano Hacendado,1.8,0.1,2025-11-25 07:27:02
52405,Queso en porciones Hacendado,2.1,0.375,2025-11-25 07:27:03
51232,Queso en porciones light Hacendado,1.65,0.25,2025-11-25 07:27:03
51504,Queso en porciones mini Babybel,3.8,0.16,2025-11-25 07:27:03
51197,Queso feta mezcla Hacendado en dados,2.4,0.37,2025-11-25 07:27:09
51043,Queso fresco 0% m.g de vaca Burgo de Arias,3.3,0.216,2025-11-25 07:27:11
51071,Queso fresco batido desnatado 0% m.g Hacendado,1.1,0.5,2025-11-25 07:27:10
52409,Queso fresco Burgos desnatado 0% m.g Hacendado,1.15,0.25,2025-11-25 07:27:08
52407,Queso fresco Burgos desnatado 0% m.g Hacendado,2.05,0.5,2025-11-25 07:27:12
52406,Queso fresco Burgos natural Hacendado,2.05,0.5,2025-11-25 07:27:07
52408,Queso fresco Burgos natural Hacendado,1.15,0.25,2025-11-25 07:27:08
52411,Queso fresco Burgos sin lactosa Hacendado,1.9,0.25,2025-11-25 07:27:12
60963,Queso fresco cottage semidesnatado de vaca Hacendado,1.35,0.2,2025-11-25 07:27:13
51194,Queso fresco de cabra Hacendado,2.8,0.25,2025-11-25 07:27:09
50386,Queso fresco de cabra Hacendado,2.97,0.25,2025-11-25 07:27:13
51044,Queso fresco de vaca Burgo de Arias,3.3,0.216,2025-11-25 07:27:09
51191,Queso fresco de vaca Hacendado,1.7,0.25,2025-11-25 07:27:10
51192,Queso fresco light de vaca Hacendado,2.2,0.25,2025-11-25 07:27:11
51072,Queso fresco mascarpone de vaca Hacendado,2.75,0.25,2025-11-25 07:27:10
50160,Queso fresco mascarpone de vaca Hacendado,5.0,0.5,2025-11-25 07:27:10
50401,Queso fresco servilleta tradicional de vaca Hacendado,2.45,0.25,2025-11-25 07:27:08
51210,Queso fresco tronchón mezcla Hacendado,2.95,0.25,2025-11-25 07:27:13
51068,Queso fundido con palitos La vaca que ríe,2.59,0.14,2025-11-25 07:27:04
50613,Queso gorgonzola de vaca Hacendado,2.13,0.17,2025-11-25 07:27:16
23037,Queso grana padano Hacendado en escamas,2.7,0.1,2025-11-25 07:26:49
50008,Queso grana padano Zanetti,3.91,0.23,2025-11-25 07:26:45
8180,Queso lonchas cheddar de vaca Hacendado,2.0,0.2,2025-11-25 07:26:59
50545,Queso lonchas cremoso de vaca Hacendado,3.0,0.3,2025-11-25 07:26:56
50546,Queso lonchas cremoso light de vaca Hacendado,3.0,0.3,2025-11-25 07:26:57
50153,Queso lonchas de cabra Hacendado,3.15,0.22,2025-11-25 07:26:58
50151,Queso lonchas de oveja Entrepinares,2.89,0.21,2025-11-25 07:27:00
50459,Queso lonchas edam de vaca Holland Corona,2.4,0.3,2025-11-25 07:26:59
60710,Queso lonchas emmental de vaca Hacendado,2.25,0.2,2025-11-25 07:27:00
51198,Queso lonchas fundido burger mezcla Hacendado,1.9,0.3,2025-11-25 07:27:00
51182,Queso lonchas fundido suave mezcla Hacendado,2.35,0.555,2025-11-25 07:26:59
50371,Queso lonchas fundido sándwich mezcla Hacendado,1.3,0.2,2025-11-25 07:26:57
50654,Queso lonchas gouda de vaca Hacendado,2.55,0.3,2025-11-25 07:26:58
51126,Queso lonchas mozzarella de vaca Hacendado,1.8,0.2,2025-11-25 07:26:59
50148,Queso lonchas semicurado mezcla Entrepinares,2.57,0.21,2025-11-25 07:26:57
12846,Queso lonchas sin lactosa de vaca Hacendado,2.6,0.2,2025-11-25 07:27:00
50543,Queso lonchas tierno de vaca Entrepinares,2.55,0.3,2025-11-25 07:26:58
50385,Queso lonchas tierno mezcla Entrepinares,2.49,0.25,2025-11-25 07:26:57
5515,Queso Morbier de vaca Hacendado,4.09,0.2,2025-11-25 07:26:50
4929,Queso precortado de cabra Hacendado,2.65,0.2,2025-11-25 07:27:17
4848,Queso provolone de vaca Hacendado,2.6,0.2,2025-11-25 07:27:17
15300,Queso raclette ahumada de vaca Richesmonts,2.95,0.2,2025-11-25 07:27:18
51234,Queso rallado 4 quesos Hacendado,1.83,0.18,2025-11-25 07:27:01
22216,Queso rallado emmental gratinar Hacendado,1.73,0.2,2025-11-25 07:27:01
23622,Queso rallado especial fundir mezcla Hacendado,2.3,0.4,2025-11-25 07:27:02
23621,Queso rallado especial fundir mezcla Hacendado,1.3,0.2,2025-11-25 07:27:02
51110,Queso rallado mozzarella pizza-Roma de vaca Hacendado,1.65,0.2,2025-11-25 07:27:01
51236,Queso rallado sin lactosa de vaca Hacendado,1.8,0.15,2025-11-25 07:27:02
51228,Queso ricotta mezcla Hacendado,1.6,0.2,2025-11-25 07:27:12
86276,Queso roquefort  de oveja Hacendado,1.9,0.1,2025-11-25 07:27:14
51619,Queso rulo con piña y almendra Liptana,1.5,0.1,2025-11-25 07:27:15
50021,Queso rulo de cabra Hacendado,2.35,0.2,2025-11-25 07:27:14
50942,Queso semicurado de cabra Hacendado,4.54,0.3,2025-11-25 07:26:53
5882,Queso semicurado de oveja Hacendado,3.78,0.28,2025-11-25 07:26:53
50946,Queso semicurado mezcla Hacendado,14.49,1.54,2025-11-25 07:26:51
50945,Queso semicurado mezcla Hacendado,10.79,1.08,2025-11-25 07:26:52
50943,Queso semicurado mezcla Hacendado,4.14,0.42,2025-11-25 07:26:52
50944,Queso semicurado mezcla Hacendado cortado en cuñitas,4.3,0.34,2025-11-25 07:26:52
50941,Queso semicurado sin lactosa mezcla Hacendado,5.63,0.43,2025-11-25 07:26:53
50915,Queso tierno bajo en sal mezcla Hacendado,3.87,0.35,2025-11-25 07:26:55
50483,Queso tierno bola edam de vaca Holland Corona,4.1,0.455,2025-11-25 07:26:56
50927,Queso tierno de cabra Hacendado,4.9,0.35,2025-11-25 07:26:56
50935,Queso tierno de vaca Hacendado,6.7,1.05,2025-11-11 07:28:40
50916,Queso tierno de vaca Hacendado cortado en cuñitas,2.62,0.32,2025-11-25 07:26:54
50478,Queso tierno gouda de vaca Holland,3.8,0.45,2025-11-25 07:26:56
50480,Queso tierno maasdam de vaca Holland Corona,3.7,0.4,2025-11-25 07:26:55
50919,Queso tierno mezcla Hacendado,10.61,1.22,2025-11-25 07:26:54
50917,Queso tierno mezcla Hacendado,3.13,0.35,2025-11-25 07:26:55
50918,Queso tierno mezcla Hacendado cortado en cuñitas,3.82,0.325,2025-11-25 07:26:55
50022,Queso tierno tronchón mezcla Hacendado,13.8,1.2,2025-11-25 07:26:54
50020,Queso tierno tronchón mezcla Hacendado,3.21,0.26,2025-11-25 07:26:54
51211,Queso untar con queso azul de vaca Hacendado,1.9,0.2,2025-11-25 07:27:06
51208,Queso untar de vaca con finas hierbas Hacendado,1.85,0.2,2025-11-25 07:27:06
51066,Queso untar de vaca con salmón Hacendado,1.9,0.2,2025-11-25 07:27:06
51223,Queso untar light de vaca Hacendado,1.45,0.3,2025-11-25 07:27:05
51079,Queso untar light Philadelphia,2.85,0.27,2025-11-25 07:27:05
51073,Queso untar original Philadelphia,2.85,0.27,2025-11-25 07:27:04
51212,Queso untar sin lactosa de vaca Hacendado,1.9,0.2,2025-11-25 07:27:06
51203,Queso untar suave de vaca Hacendado,1.45,0.3,2025-11-25 07:27:04
50976,Queso viejo ahumado de oveja Hacendado,5.9,0.33,2025-11-25 07:26:47
50969,Queso viejo cremoso de oveja Hacendado,5.29,0.3,2025-11-25 07:26:49
50984,Queso viejo de oveja Hacendado,19.25,1.54,2025-11-25 07:26:46
50970,Queso viejo de oveja Hacendado,4.25,0.31,2025-11-25 07:26:46
11561,Queso viejo de oveja Hacendado,23.0,2.8,2025-11-25 07:26:51
50974,Queso viejo intenso mezcla Hacendado,4.74,0.33,2025-11-25 07:26:47
50985,Queso viejo tostado mezcla Hacendado,20.94,1.56,2025-11-25 07:26:45
50971,Queso viejo tostado mezcla Hacendado,5.59,0.395,2025-11-25 07:26:46
