id,name,last_price,unit_size,last_update
13715,"Comida gato adulto Supreme Compy con salmón, frutas y verduras",5.8,1.5,2026-02-11 20:20:18
15640,"Comida gato júnior Compy con pollo, frutas y verduras",3.3,1.5,2026-02-11 20:20:16
23174,"Comida gato sénior Supreme Compy con pollo fresco, frutas y verduras",6.3,1.5,2026-02-11 20:20:18
15974,"Comida perro adulto Compy con pollo, ternera, frutas y verduras",19.5,18.0,2026-02-11 20:20:26
15972,"Comida perro adulto Compy con pollo, ternera, frutas y verduras",6.5,4.0,2026-02-11 20:20:27
15970,"Comida perro adulto Compy con pollo, ternera, frutas y verduras",5.75,3.0,2026-02-11 20:20:27
15973,"Comida perro adulto Compy con salmón, atún, frutas y verduras",7.0,4.0,2026-02-11 20:20:28
38297,"Comida perro adulto Compy con ternera, pollo, verduras y arroz",16.95,18.0,2026-02-11 20:20:26
52101,Comida perro adulto Compy original,12.8,18.0,2026-02-11 20:20:28
15979,Comida perro adulto Supreme Compy pollo fresco con frutas y verduras,24.5,10.0,2026-02-11 20:20:30
15978,Comida perro adulto Supreme Compy pollo fresco con frutas y verduras,9.5,3.0,2026-02-11 20:20:31
15976,Comida perro adulto Supreme Compy pollo fresco con frutas y verduras,5.25,1.5,2026-02-11 20:20:31
15981,Comida perro adulto Supreme Compy salmón fresco con frutas y verduras,26.5,10.0,2026-02-11 20:20:30
15980,Comida perro adulto Supreme Compy salmón fresco con frutas y verduras,10.5,3.0,2026-02-11 20:20:30
15977,Comida perro adulto Supreme Compy salmón fresco con frutas y verduras,6.0,1.5,2026-02-11 20:20:30
23204,"Comida perro júnior Compy con pollo, arroz, frutas y verduras",7.0,4.0,2026-02-11 20:20:26
23207,"Comida perro júnior Supreme Compy con pollo fresco, frutas y verduras",6.0,1.5,2026-02-11 20:20:28
23171,Comida perro sénior esterilizados Supreme Compy pollo fresco con frutas y verduras,5.25,1.5,2026-02-11 20:20:29
23206,"Comida perro sénior y adultos esterilizados Supreme Compy con pollo, frutas y verduras",7.0,4.0,2026-01-06 19:54:31
23209,"Comida perro sénior y adultos esterilizados Supreme Compy con pollo, frutas y verduras",9.5,3.0,2026-02-11 20:20:29
34121,Comino en grano Hacendado,1.95,0.056,2026-02-11 20:02:01
34120,Comino molido Hacendado,1.2,0.058,2026-02-11 20:02:00
53011,Compango,2.6,0.25,2026-02-11 20:07:04
47312,Compresa con alas noche Ausonia,2.5,1.0,2026-02-11 20:14:20
47348,Compresa con alas noche Deliplus Suave,1.15,1.0,2026-02-11 20:14:18
47383,Compresa con alas noche plegada Deliplus Classic,1.4,1.0,2026-02-11 20:14:17
47310,Compresa con alas normal Ausonia,2.5,1.0,2026-02-11 20:14:21
86449,Compresa con alas normal Deliplus Cotton,3.4,1.0,2026-02-11 20:14:23
47340,Compresa con alas normal Deliplus Dry,2.15,1.0,2026-02-11 20:14:19
47343,Compresa con alas normal Deliplus Suave,2.15,1.0,2026-02-11 20:14:17
47368,Compresa con alas normal Deliplus Suave,1.0,1.0,2026-02-11 20:14:22
86352,Compresa con alas normal Evax cotton like fresh,4.5,1.0,2026-02-11 20:14:19
47311,Compresa con alas super Ausonia,2.5,1.0,2026-02-11 20:14:21
86450,Compresa con alas super Deliplus Cotton,3.4,1.0,2026-02-11 20:14:23
47342,Compresa con alas super Deliplus Dry,2.15,1.0,2026-02-11 20:14:20
47346,Compresa con alas super Deliplus Suave,2.15,1.0,2026-02-11 20:14:19
86353,Compresa con alas super Evax cotton like fresh,4.2,1.0,2026-02-11 20:14:20
47010,Compresa de incontinencia Tena masculina,5.0,1.0,2026-02-11 20:14:32
35678,Compresa sin alas de incontinencia Deliplus Extra,3.35,20.0,2026-02-11 20:14:18
35679,Compresa sin alas de incontinencia Deliplus Maxi,3.15,12.0,2026-02-11 20:14:17
22926,Compresa sin alas de incontinencia Deliplus Maxi Night,3.15,10.0,2026-02-11 20:14:23
23132,Compresa sin alas de incontinencia Deliplus Mini,3.35,30.0,2026-02-11 20:14:22
35677,Compresa sin alas de incontinencia Deliplus Normal,3.35,24.0,2026-02-11 20:14:20
47380,Compresa sin alas normal Deliplus Classic,1.1,1.0,2026-02-11 20:14:16
47344,Compresa sin alas normal Deliplus Suave,2.15,1.0,2026-02-11 20:14:21
7880,Compresa sin alas normal Evax cotton like,2.85,1.0,2026-02-11 20:14:23
47381,Compresa sin alas normal plegada Deliplus Classic,1.2,1.0,2026-02-11 20:14:18
47347,Compresa sin alas super Deliplus Suave,2.15,1.0,2026-02-11 20:14:22
47382,Compresa sin alas super plegada Deliplus Classic,1.4,1.0,2026-02-11 20:14:19
52965,Comprimidos cabello y uñas Deliplus,3.95,0.024,2026-02-11 20:15:16
79594,Comprimidos efervescentes magnesio Deliplus 300 mg sabor naranja,1.95,0.078,2026-02-11 20:15:15
35620,Comprimidos efervescentes vitamina C y zinc Deliplus sabor limón,1.95,0.08,2026-02-11 20:15:11
79621,Comprimidos Vitaminas y Minerales Deliplus,3.0,0.0279,2026-02-11 20:15:11
18554,Concha fina al natural Hacendado,1.9,0.09,2026-02-11 20:11:26
2797,Conejo entero,10.41,1.21,2026-02-11 20:07:40
15093,Confitura de fresa Hacendado 0% azúcares añadidos,1.6,0.38,2026-02-11 20:05:01
15094,Confitura de melocotón Hacendado 0% azúcares añadidos,1.6,0.38,2026-02-11 20:05:02
9792,Cono de golosinas celebración Hacendado,1.25,1.0,2026-02-11 20:04:56
15778,Conos sabor bacón y queso Hacendado,0.8,0.1,2026-02-11 20:03:54
9784,Contorno de ojos Antiarrugas e Iluminador con silicio Sisbela Reafirm Deliplus,4.5,0.015,2026-02-11 20:13:27
46872,Contorno de ojos arrugas y bolsas Deliplus Prevent Age Skin,4.5,0.015,2026-02-11 20:13:28
46866,Contorno de ojos Men Care Regen Skin Deliplus,5.0,0.015,2026-02-11 20:13:02
2789,Contramuslos de pollo deshuesados y sin piel,3.58,0.55,2026-02-11 20:07:11
2777,Contramuslos de pollo sin piel,3.4,0.81,2026-02-11 20:07:18
25258,Contramuslos deshuesados y sin piel de pollo certificado alimentado con un 50% de maíz,4.5,0.5,2026-02-11 20:07:24
20593,Copa crema de chocolate y nata Hacendado,1.4,0.46,2026-02-11 20:22:51
60550,"Copa de chocolate y nata +Proteínas Hacendado 12,5 g proteínas",2.55,0.5,2026-02-11 20:22:54
86349,Copas cava de plástico brillo Bosque Verde,2.9,6.0,2025-12-29 07:41:41
86341,Copos de avena Brüggen,1.35,0.8,2026-02-11 20:08:10
20292,Copos de avena integral con chocolate Hacendado,1.85,0.4,2026-02-11 20:08:16
86368,Copos de avena sin gluten Hacendado,2.1,0.5,2026-02-11 20:08:10
15193,Coquito,0.19,0.033,2026-02-11 20:20:57
16040,Corazones de alcachofa Hacendado,1.9,0.29,2026-02-11 20:11:33
19959,Corazones de alcachofa Hacendado,3.0,0.26,2026-02-11 20:11:33
11958,Corazones de alcachofa Hacendado,2.25,0.43,2026-02-11 20:11:38
9963,Cordero chuleteado,16.0,0.64,2026-02-11 20:07:42
20295,Corrector de arrugas Botox Like Serum Deliplus,6.0,0.01,2025-11-13 07:30:29
15272,Corrector fluido Hydra Deliplus 100 porcelana,5.0,0.01,2026-02-11 20:18:42
15273,Corrector fluido Hydra Deliplus 200 vainilla,5.0,0.01,2026-02-11 20:18:43
15274,Corrector fluido Hydra Deliplus 300 arena,5.0,0.01,2026-02-11 20:18:43
15276,Corrector fluido multiusos Long Lasting Deliplus mate 100 beige rosado,4.75,0.01,2026-02-11 20:18:41
15277,Corrector fluido multiusos Long Lasting Deliplus mate 200 vainilla,4.75,0.01,2026-02-11 20:18:41
15278,Corrector fluido multiusos Long Lasting Deliplus mate 210 arena,4.75,0.01,2026-02-11 20:18:42
15279,Corrector fluido multiusos Long Lasting Deliplus mate 300 cappuccino,4.75,0.01,2026-02-11 20:18:42
15171,Corrector Mate Stick Deliplus 100 beige rosado,4.25,1.0,2026-02-11 20:18:41
15177,Corrector Mate Stick Deliplus 200 vainilla,4.25,1.0,2026-02-11 20:18:41
15169,Corrector serum luminoso Deliplus 100 beige claro,5.0,0.004,2026-02-11 20:18:40
15170,Corrector serum luminoso Deliplus 200 beige oscuro,5.0,0.004,2026-02-11 20:18:40
22528,Corta cutículas Deliplus,2.1,1.0,2026-02-11 20:14:41
85745,Cortadillo de cabello de Ángel La Muralla,0.24,0.057,2026-01-06 07:40:24
23404,Cortado en cápsula descafeinado Hacendado,3.55,0.0912,2026-02-11 20:06:41
22170,Cortaúñas manos y pies Deliplus,1.9,1.0,2026-02-11 20:14:42
81055.3,Corvina a filetes,14.72,1.28,2026-02-11 20:19:59
81055.2,Corvina abierta a la espalda con espinas y con cabeza,14.72,1.28,2026-02-11 20:19:59
81055.1,Corvina limpia con cabeza,14.72,1.28,2026-02-11 20:19:58
35286,Costilla de cerdo churrasco,4.67,0.82,2026-02-11 20:07:31
1564,Costilla de cerdo ibérico adobada,3.78,0.5,2026-02-11 20:08:03
3499,Costilla de vacuno,3.83,0.25,2026-02-11 20:07:06
13709,Costillas de cerdo a la barbacoa cortadas Hacendado,6.25,0.5,2026-02-11 20:22:24
2811,Costillas de cerdo carnosas a tacos,4.96,0.62,2026-02-11 20:07:30
49064,Cotillón Nochevieja,1.5,1.0,2025-12-29 19:47:34
82938,Coulant de chocolate Hacendado,2.2,0.18,2026-02-11 20:22:53
9395,Cous cous mediano Bia,1.95,1.0,2026-02-11 20:04:02
82412,Crackers 30% integral,1.85,0.5,2026-02-11 20:21:40
82439,Crackers con sal Hacendado,1.85,0.5,2026-02-11 20:21:40
82626,Crackers integrales de espelta Bachman,1.65,0.24,2026-02-11 20:21:39
82651,Crackers sin gluten Hacendado con romero,1.7,0.2,2026-02-11 20:21:41
78861,Crema adhesiva para prótesis dentales Benfix sin sabor,3.5,0.05,2026-02-11 20:14:13
67416,Crema al cacao con avellanas Hacendado,2.05,0.5,2026-02-11 20:04:51
67417,Crema al cacao con avellanas Hacendado de 2 sabores,2.05,0.5,2026-02-11 20:04:52
67163,Crema al cacao con avellanas Nocilla original,4.0,0.36,2026-02-11 20:04:51
67409,Crema al cacao con avellanas Nutella,4.0,0.35,2026-02-11 20:04:51
67164,Crema al cacao y leche con avellanas Nocilla,4.0,0.36,2026-02-11 20:04:52
73984,"Crema cara, cuerpo y manos Nivea Men",4.95,0.15,2026-02-11 20:13:01
67634,Crema catalana Hacendado,2.75,0.4,2026-02-11 20:22:54
50140,Crema contorno de ojos y párpados Dragon's blood Deliplus Anti Ox,4.5,0.015,2026-02-11 20:13:28
46768,Crema corporal anticelulítica Deliplus,2.0,0.25,2026-02-11 20:13:06
13972,Crema corporal Esferas Vit. E&A Deliplus,3.1,0.3,2026-02-11 20:13:08
76542,Crema corporal Nivea,4.0,0.25,2026-02-11 20:13:04
13970,Crema corporal Olive Deliplus,1.8,0.3,2026-02-11 20:13:09
11630,Crema de avellanas y cacao Hacendado,2.45,0.4,2026-02-11 20:04:51
16883,Crema de cacahuete 100% Hacendado,2.85,0.5,2026-02-11 20:04:52
35870,Crema de calabacín Hacendado,1.7,0.35,2026-02-11 20:11:46
14930,Crema de calabacín Hacendado,1.0,0.5,2026-02-11 20:11:46
35661,Crema de calabacín Starlux con queso de cabra,1.5,0.5,2026-02-09 08:05:07
13499,Crema de calabaza Hacendado,1.0,0.5,2026-02-11 20:11:45
23225,Crema de calabaza y zanahoria Hacendado,1.7,0.35,2026-02-11 20:11:44
70030,Crema de calzado blanco autobrillante Bosque Verde con aplicador,0.95,0.05,2026-01-21 07:40:20
70028,Crema de calzado marrón autobrillante Bosque Verde con aplicador,0.95,0.05,2026-02-11 20:18:32
70024,Crema de calzado negro autobrillante Bosque Verde con aplicador,0.95,0.05,2026-01-25 19:48:33
86587,Crema de espárragos Hacendado,1.7,0.35,2026-02-11 20:11:44
10449,Crema de leche para café Campina,1.4,0.2,2026-02-11 20:16:48
11628,Crema de lentejas Hacendado,1.7,0.35,2026-02-11 20:11:47
35121,Crema de manos anti-manchas Deliplus FPS 20,1.3,0.075,2026-02-11 20:13:11
46812,Crema de manos flor de Japón Deliplus Hidrata & Perfuma,1.0,0.03,2026-02-11 20:13:10
35101,Crema de manos hidratante con aloe vera Deliplus,1.0,0.075,2026-02-11 20:13:10
46615,Crema de manos intensiva Dove,2.0,0.075,2026-02-11 20:13:11
35799,Crema de manos nutritiva Karité Deliplus,1.3,0.075,2026-02-11 20:13:12
19868,Crema de manos Oriental Woods Deliplus,3.0,0.29,2026-02-11 20:13:12
35100,Crema de manos reparadora Deliplus,1.3,0.075,2026-02-11 20:13:11
74102,"Crema de manos, cara y cuerpo Nivea Soft hidratante intensiva",1.95,0.075,2026-02-11 20:13:11
8447,Crema de marisco Hacendado,2.0,0.5,2026-02-09 08:05:07
8448,Crema de pollo Hacendado con verduras,1.0,0.5,2026-02-11 20:11:45
22701,Crema de queso brie con trufa Hacendado,1.8,0.15,2026-01-18 07:26:34
51181,Crema de queso camembert Hacendado,1.8,0.15,2026-02-11 20:09:50
15191,Crema de queso mascarpone y queso azul Hacendado,1.8,0.15,2026-01-03 07:27:43
22780,Crema de queso viejo tostado mezcla Hacendado,1.74,0.15,2026-02-11 20:09:51
35662,Crema de setas Starlux con champiñones,1.6,0.5,2026-02-11 20:11:46
10376,Crema de soja Hacendado,1.1,0.2,2026-02-11 20:16:55
8722,Crema de verduras Hacendado,1.7,0.35,2026-02-11 20:11:44
60308,Crema de verduras Hacendado,1.0,0.5,2026-02-11 20:11:45
4908,Crema de vinagre balsámico de Módena Hacendado,1.8,0.25,2026-02-11 20:01:48
60046,Crema decolorante rostro y cuerpo Deliplus piel sensible,3.5,0.15,2026-02-11 20:13:33
9879,Crema depilatoria facial Deliplus piel sensible,2.3,0.02,2026-02-11 20:13:34
86088,Crema depilatoria hombre Deliplus piel normal,2.8,0.2,2026-02-11 20:13:32
86089,Crema depilatoria mujer para el cuerpo Deliplus piel sensible,2.8,0.2,2026-02-11 20:13:32
11941,Crema facial Antiarrugas y Reafirmante Men care Deliplus ácido hialurónico y matrixyl,5.0,0.05,2026-02-11 20:13:26
50124,Crema facial Dragon's Blood Anti Ox Deliplus regeneradora FPS 12,5.0,0.05,2026-02-11 20:13:23
46869,Crema facial día Antiarrugas Regen Skin Deliplus,5.5,0.05,2026-02-11 20:13:23
50375,Crema facial fluida hidratante Deliplus Oil Free,4.0,0.05,2026-02-11 20:13:23
50256,Crema facial Hidrata Deliplus ácido hialurónico y aloe vera,5.0,0.05,2026-02-11 20:13:25
50326,Crema facial hidratante anti-rojeces Deliplus Sensitive con vitamina K Ox,6.0,0.05,2026-02-11 20:13:24
21364,Crema facial hidratante con color Skiny Glow Tint Deliplus con pigmentos encapsulados,9.0,0.03,2026-01-20 07:34:48
42477,Crema facial noche Deliplus aclarante anti-manchas,5.5,0.05,2026-02-11 20:13:24
46870,Crema facial noche Textura Rica Regen Skin Deliplus,5.5,0.05,2026-02-11 20:13:23
12848,Crema facial Nutritiva redensificadora Green Caviar y Colágeno Prevent Age Ski Deliplus,5.5,0.05,2026-02-11 20:13:26
79021,Crema facial Power Age L'Oréal men expert hidratante anti-edad,8.95,0.05,2025-11-18 07:30:01
46861,Crema facial protectora anti-manchas Deliplus FPS 50+,5.5,0.05,2026-02-11 20:13:25
12826,Crema facial Retinal primeras arrugas Prevent Age Skin Deliplus,5.5,0.05,2026-02-11 20:13:26
50170,"Crema facial Revitaliza y Reestructura Sisbela Reafirm Deliplus con ácido ribonucleico RNA, ácido desoxirribonucleico DNA y silicio",5.0,0.05,2026-02-11 20:13:22
46833,Crema hidratante para pies Deliplus anti-sequedad,1.5,0.125,2026-02-11 20:13:13
13633,Crema limpiadora Vitrocerámicas Vitroclen 5 en 1,4.9,0.42,2026-02-11 20:17:52
46771,Crema para pies 10% urea pura Deliplus,1.2,0.125,2026-02-11 20:13:13
23430,Crema protección solar Deliplus FPS 50+,4.2,0.1,2026-02-11 20:15:09
60613,Crema protección solar facial Deliplus FPS 50+,6.0,0.05,2026-02-11 20:15:09
63528,Crepes Hacendado ultracongelados,2.45,0.4,2026-02-11 20:10:58
82551,Crepes rellenos de chocolate Hacendado,1.45,0.192,2026-02-11 20:20:52
84692,Croissant de mantequilla 26%,0.55,0.05,2026-02-11 20:20:38
82931,Croissant Hacendado,1.85,0.43,2026-02-11 20:20:49
82932,Croissant relleno de crema al cacao Hacendado,1.95,0.375,2026-02-11 20:20:49
23127,Croquetas caprichos de jamón Hacendado ultracongeladas,2.85,0.5,2026-02-11 20:10:47
13496,Croquetas de cocido Hacendado ultracongeladas,2.0,0.35,2026-02-11 20:10:46
63400,Croquetas de jamón Hacendado ultracongeladas,1.4,0.5,2026-02-11 20:10:46
60954,Croquetas de merluza Hacendado ultracongelados,2.3,0.35,2026-02-11 20:19:44
68322,Cuajada Hacendado,1.25,0.5,2026-02-11 20:22:53
11480,Cuarto de cochinillo asado Listo para Comer con cebolla confitada y patatas panaderas,50.0,1.85,2026-01-29 20:06:27
2854,Cuarto de gallina,3.94,0.68,2026-02-11 20:07:06
3727,Cuartos traseros de pollo,2.9,0.88,2026-02-11 20:07:13
2783,Cuartos traseros de pollo certificado alimentado con un 50% de maíz,4.15,0.83,2026-02-11 20:07:17
25182,Cuartos traseros de pollo congelados,5.9,2.0,2026-02-11 20:10:08
3680,Cuartos traseros familiar de pollo,5.36,1.73,2026-02-11 20:07:13
35920,Cubo con ruedas 13L Bosque Verde,3.6,1.0,2026-02-11 20:18:30
48649,"Cubo de basura mediano 30L Bosque Verde 30,2 x 30,5 x 41,9 cm",8.3,1.0,2026-02-11 20:18:29
48651,"Cubo de basura pequeño 10L Bosque Verde 24,1 x 25 x 24,7 cm",7.25,1.0,2026-02-11 20:18:29
64133,Cubos de hielo,5.75,10.0,2026-02-11 20:10:22
64126,Cubos de hielo,1.15,2.0,2026-02-11 20:10:22
13717,Cucharas de plástico Bosque Verde reutilizables,1.55,15.0,2026-02-11 20:18:11
13719,Cucharas postre de plástico Bosque Verde reutilizables,1.45,15.0,2026-02-11 20:18:11
12754,Cuchillas para perfilar cejas y vello facial Deliplus,2.8,3.0,2026-02-11 20:13:37
13718,Cuchillos de plástico Bosque Verde reutilizables,1.55,15.0,2026-02-11 20:18:11
74817,Cuidado hidratante Hydra energetic L'Oréal men expert anti-fatiga 24h,6.95,0.05,2026-02-11 20:13:01
33581,Cuquis Hacendado,0.75,0.08,2026-02-11 20:03:54
33642,Cuquitos sabor queso Hacendado,0.75,0.1,2026-02-11 20:03:54
34125,Curry Hacendado,1.1,0.057,2026-02-11 20:02:01
13796,Cápsulas Alcachofa Deliplus,3.95,0.01635,2026-02-11 20:15:13
35944,Cápsulas Articular Forte Deliplus,4.2,0.01545,2026-02-11 20:15:15
13861,Cápsulas Cola de caballo Deliplus,3.85,0.01635,2026-02-11 20:15:13
35943,Cápsulas Colagen Antiox piel Deliplus,4.95,0.0171,2026-02-11 20:15:14
35880,Cápsulas Gases Deliplus,4.5,0.01695,2026-02-11 20:15:16
13797,Cápsulas LaxForte Deliplus,3.95,0.01635,2026-02-11 20:15:12
35945,Cápsulas Memory Forte Deliplus,3.95,0.01785,2026-02-11 20:15:14
79704,Cápsulas Menopausia Deliplus,4.5,0.019351,2026-02-11 20:15:15
7914,Cápsulas para ojos Regen Skin Deliplus,5.0,0.0039,2026-02-11 20:13:28
52589,Cápsulas Probiótico Deliplus,5.95,0.01785,2026-02-11 20:15:16
79063,Cápsulas Quemagrasas Deliplus,3.95,0.01785,2026-02-11 20:15:14
35991,Cápsulas Spirulina + vitamina B12 Deliplus,5.0,0.0327,2026-02-11 20:15:15
23367,Cápsulas Valeriana Deliplus,4.15,0.0327,2026-02-11 20:15:12
7977,Cápsulas vitamina C 10% Antiox Deliplus,7.0,0.0005,2025-12-02 07:34:17
34163,Cúrcuma Hacendado,1.3,0.06,2026-02-11 20:02:02
68124,Danonino sabor fresa Danone,1.45,0.3,2026-02-11 20:23:21
68125,Danonino sabor fresa y plátano Danone,1.45,0.3,2026-02-11 20:23:21
63322,Delicias de pollo Hacendado ultracongeladas,3.7,0.5,2026-02-11 20:10:46
51626,Delicias de queso rellenos de mermelada Hacendado,4.1,0.215,2026-01-03 07:27:55
62503,Delicias del mar de surimi Hacendado,2.0,0.25,2026-02-11 20:19:36
14956,Delineador de cejas Brow Liner Terra Deliplus 01 castaño medio,4.0,1.0,2026-01-07 19:49:53
14957,Delineador de cejas Brow Liner Terra Deliplus 02 castaño oscuro,4.0,1.0,2025-11-29 19:44:23
52504,Delineador de ojos Deliplus,3.75,1.0,2026-02-11 20:19:12
80264,Delineador de ojos Deliplus negro,3.75,1.0,2026-02-11 20:19:12
20735,Delineador de ojos Eyeliner Duo Celestial Night Deliplus negro y dorado,3.0,1.0,2026-02-09 08:13:01
35982,Dentífrico 3 action Deliplus,1.1,0.1,2026-02-11 20:14:05
35983,Dentífrico Anticaries Deliplus,1.05,0.1,2026-02-11 20:14:05
46724,Dentífrico Bicarbonato blanqueador Deliplus,1.1,0.1,2026-02-11 20:14:02
74044,Dentífrico Blanqueador Bicarbonato Signal,1.85,0.1,2026-02-11 20:14:02
13868,Dentífrico Blanqueante Sensodyne,3.95,0.075,2026-02-11 20:14:03
46727,Dentífrico Dental Pearl Deliplus blanqueador,1.95,0.1,2026-02-11 20:14:05
12901,Dentífrico Encías Protect Deliplus,1.7,0.1,2026-02-11 20:14:04
46730,Dentífrico Fresh Gel Deliplus menta extra refrescante,1.1,0.1,2026-02-11 20:14:04
15349,Dentífrico gel Blanqueador Xtrem Deliplus,1.7,0.1,2026-02-11 20:14:08
8996,Dentífrico Herbal Deliplus,1.1,0.1,2026-02-11 20:14:04
46997,Dentífrico infantil + 2 años Deliplus,1.0,0.075,2026-02-11 20:14:06
23674,Dentífrico infantil +6 años Deliplus menta suave,1.0,0.075,2026-02-11 20:14:06
23675,Dentífrico infantil +6 años Deliplus sabor gominola,1.0,0.075,2026-02-11 20:14:07
73999,Dentífrico Max Fresh Colgate sabor menta fresca,2.85,0.1,2026-02-11 20:14:04
73431,Dentífrico Max White One Colgate,2.65,0.075,2026-02-11 20:14:03
13913,Dentífrico Pro-Expert Oral-B sabor menta especiada,2.85,0.075,2026-02-11 20:14:01
73979,Dentífrico Protección Caries Colgate,1.95,0.1,2026-02-11 20:14:02
13869,Dentífrico Repair & Protect Sensodyne,4.8,0.075,2026-02-11 20:14:03
35654,Dentífrico reparación activa de encías Parodontax menta fresca,4.95,0.075,2026-02-11 20:14:07
46739,Dentífrico Sensitive Deliplus con hidroxiapatita,1.5,0.1,2026-02-11 20:14:06
15348,Dentífrico Total Expert Deliplus con paraprobiótico,1.9,0.1,2026-02-11 20:14:08
79593,Dentífrico Total original Colgate,2.9,0.075,2026-02-11 20:14:02
73978,Dentífrico Triple Acción Colgate menta intensa,1.95,0.1,2026-02-11 20:14:01
43042,Desatascador Turbo Bosque Verde en gel,1.7,0.5,2026-02-11 20:17:35
43931,Desincrustante de Cementos y Limpiajuntas Bosque Verde,4.0,0.75,2026-02-11 20:17:56
40567,Desinfectante Tejidos y Lavadora Bosque Verde sin lejía,2.1,1.0,2026-02-11 20:16:58
46949,Desmaquillador de ojos y labios bifásico Waterproof Facial Clean,2.0,0.15,2026-02-11 20:13:18
35362,Desodorante aloe Deliplus antitranspirante,1.7,0.2,2026-02-11 20:13:43
35363,Desodorante aloe Deliplus antitranspirante,1.5,0.075,2026-02-11 20:13:48
23515,Desodorante aqua Deliplus antimanchas,1.7,0.2,2026-02-11 20:13:43
46443,Desodorante avena Deliplus antitranspirante,1.7,0.2,2026-02-11 20:13:47
44399,Desodorante cobalt dry Rexona Men antitranspirante,2.9,0.2,2026-02-11 20:13:46
12902,Desodorante Dark Deliplus antimanchas,1.7,0.2,2026-02-11 20:13:48
12968,Desodorante Dark Temptation Axe Essentiel,3.35,0.2,2026-02-11 20:13:46
23183,Desodorante de calzado Bosque Verde,2.95,0.25,2026-02-11 20:18:33
46107,Desodorante dermo extra control Sanex antitranspirante,2.9,0.2,2026-02-11 20:13:47
45483,Desodorante en crema original Dove antitranspirante,2.3,0.05,2026-02-11 20:13:41
13057,Desodorante en crema piel delicada Deliplus antitranspirante,1.7,0.075,2026-02-11 20:13:40
22125,Desodorante invisible Black & White Nivea,2.95,0.2,2026-02-11 20:13:44
22124,Desodorante invisible Black & White Nivea Men antitranspirante,2.95,0.2,2026-02-11 20:13:45
44398,Desodorante invisible black + white Rexona antimanchas,2.4,0.2,2026-02-11 20:13:44
46420,Desodorante invisible Deliplus antitranspirante,1.7,0.2,2026-02-11 20:13:45
44400,Desodorante invisible ice fresh Rexona Men antitranspirante y antimanchas,2.4,0.2,2026-02-11 20:13:44
46415,Desodorante invisible men Deliplus antitranspirante y antimanchas,1.7,0.2,2026-02-11 20:13:46
46001,Desodorante Lactovit anti irritaciones,2.75,0.2,2026-02-11 20:13:47
35964,Desodorante original Dove antitranspirante,3.55,0.2,2026-02-11 20:13:44
46019,Desodorante para pies en polvo Deliplus antitranspirante,2.0,0.075,2026-02-11 20:13:48
46999,Desodorante para pies fresh & dry Deliplus antitranspirante,2.0,0.15,2026-02-11 20:13:49
46434,Desodorante perfume Fashion Deliplus antitranspirante,1.7,0.2,2026-02-11 20:13:46
46989,Desodorante piedra de alumbre mineral Deonat,2.2,0.06,2026-02-11 20:13:41
23513,Desodorante power Deliplus antimanchas,1.7,0.2,2026-02-11 20:13:43
45078,Desodorante roll-on Active control Sanex men antitranspirante,2.35,0.05,2026-02-11 20:13:40
60670,Desodorante roll-on Aloe Deliplus antitranspirante,0.9,0.05,2026-02-11 20:13:38
11959,Desodorante roll-on Avena Deliplus antitranspirante,0.9,0.05,2026-02-11 20:13:39
46028,Desodorante roll-on Dermo extra control Sanex antitranspirante,2.35,0.05,2026-02-11 20:13:38
46156,Desodorante roll-on Dermo Sensitive Sanex antitranspirante,2.35,0.05,2026-02-11 20:13:39
46016,Desodorante roll-on Dry impact Nivea Men antitranspirante,2.3,0.05,2026-02-11 20:13:40
11984,Desodorante roll-on Fashion Seda Deliplus antitranspirante,0.9,0.05,2026-02-11 20:13:43
46029,Desodorante roll-on Invisible Black & White Nivea antitranspirante,2.3,0.05,2026-02-11 20:13:38
46030,Desodorante roll-on Invisible Black & White Nivea Men antitranspirante,2.3,0.05,2026-02-11 20:13:39
11986,Desodorante roll-on Invisible Deliplus antitranspirante,0.9,0.05,2026-02-11 20:13:42
11985,Desodorante roll-on Invisible men Deliplus antitranspirante,0.9,0.05,2026-02-11 20:13:42
35965,Desodorante roll-on original Dove antitranspirante,2.0,0.05,2026-02-11 20:13:41
46025,Desodorante roll-on Sensitive Byly,1.9,0.05,2026-02-11 20:13:39
47252,Desodorante roll-on Zero Sanex,2.35,0.05,2026-02-11 20:13:42
46417,Desodorante seda Deliplus antitranspirante,1.7,0.2,2026-02-11 20:13:45
52515,Desodorante stick Deo Bambú Deliplus antimanchas,1.9,0.05,2026-02-11 20:13:42
46087,Desodorante stick original Tulipán Negro,2.9,0.1,2026-02-11 20:13:40
47256,Desodorante Zero Sanex,2.9,0.2,2026-02-11 20:13:48
52752,Detergente Lavado a Mano Bosque Verde en polvo,1.9,0.65,2026-02-11 20:17:00
16830,Detergente ropa Ariel líquido,7.95,1.305,2026-02-11 20:16:57
23440,Detergente ropa Blanca y de Color Bosque Verde en cápsulas,4.4,0.528,2026-02-11 20:17:00
40404,Detergente ropa Blanca y de Color Bosque Verde en gel concentrado,3.35,0.81,2026-02-11 20:16:56
14270,Detergente ropa blanca y de color Bosque Verde en polvo,6.65,2.75,2026-02-11 20:16:59
86400,Detergente ropa Blanca y de Color Bosque Verde líquido,5.65,3.0,2026-02-11 20:16:56
14946,Detergente ropa colada mixta Micolor en gel,5.95,1.26,2026-02-11 20:16:57
86399,Detergente ropa Colonia Hipoalergénico Bosque Verde líquido,3.4,3.0,2026-02-11 20:16:58
40537,Detergente ropa de Color Bosque Verde líquido,4.4,3.0,2026-02-11 20:16:56
86398,Detergente ropa Frescura Azul Bosque Verde líquido,3.4,3.0,2025-11-24 19:48:30
11664,Detergente ropa Frescura Bosque Verde líquido,3.4,3.0,2026-02-11 20:16:58
14271,Detergente ropa jabón de Marsella Bosque Verde en polvo,5.65,2.75,2026-02-11 20:17:00
86397,Detergente ropa jabón natural de Marsella Bosque Verde líquido,3.4,3.0,2026-02-11 20:16:55
40573,Detergente ropa oscura Bosque Verde líquido,4.0,1.95,2026-02-11 20:16:58
13643,Detergente ropa Pieles Sensibles Bosque Verde líquido,4.8,1.98,2026-02-11 20:16:57
40530,Detergente ropa Prendas Delicadas Bosque Verde líquido,2.5,1.98,2026-02-11 20:16:57
