id,name,last_price,unit_size,last_update
84397,10 Pasteles de boniato 57%,3.5,0.37,2026-01-13 07:38:44
84815,10 Pasteles de cabello de Ángel 57%,3.5,0.37,2025-12-31 19:51:38
5841,11 Panecillos,1.14,0.495,2026-02-11 20:21:18
84629,12 Mini croissants de mantequilla,2.15,0.24,2026-02-11 20:20:38
84638,12 Mini saladas surtidas,1.25,0.195,2026-02-11 20:20:45
60354,2 Panes integrales 100% fino,1.4,0.165,2026-02-11 20:21:19
84597,24 Mini saladas surtidas,2.5,0.39,2026-02-11 20:20:45
83203.1,3 Barras de pan,1.19,0.75,2026-02-11 20:21:12
83232.1,3 Barras de pan aceite de oliva,1.51,0.6,2026-02-11 20:21:12
83232.2,3 Barras de pan aceite de oliva rebanadas,1.51,0.6,2026-02-11 20:21:21
83203.2,3 Barras de pan rebanadas,1.19,0.75,2026-02-11 20:21:20
9664,3 Bocadillos,1.04,0.39,2026-02-11 20:21:15
12985,3 Susos relleno de crema,1.65,0.153,2026-02-11 20:20:42
69737,3 Vegetales para microondas lavados,1.85,0.3,2026-02-11 20:16:11
6459,4 Panes chapata de cristal,1.3,0.284,2026-02-11 20:21:16
5850,4 Panes de cristal redondos cortados 100 % natural,1.85,0.24,2026-02-11 20:21:19
83452,5 Barras de pan 51% integral,1.35,0.625,2026-02-11 20:21:16
84688,6 Croissant rellenos de cacao,1.75,0.28,2026-02-11 20:20:39
84676,6 Mini empanadillas de pisto,1.75,0.2,2026-02-11 20:20:46
22388,6 Panecillos integrales 100%,1.05,0.27,2026-02-11 20:21:18
83056,6 Panes de centeno 51%,1.47,0.465,2026-02-11 20:21:17
14431,6 Panes de leche 3%,1.51,0.48,2026-02-11 20:21:17
83292,6 Panes pulguitas sin aditivos,1.05,0.24,2026-02-11 20:21:17
43861,70% Alcohol de Limpieza Perfumado Bosque Verde,2.3,1.0,2026-02-11 20:17:55
43112,70% Alcohol limpieza hogar Bosque Verde,2.6,0.75,2026-02-11 20:17:57
84937,8 Croissants surtidos rellenos de crema de cacao y crema con leche sabor a chocolate blanco,2.55,0.3,2026-02-11 20:20:43
84684,8 Magdalenas con azúcar,2.7,0.38,2026-02-11 20:20:40
84900,8 Magdalenas con pepitas de chocolate,3.1,0.38,2026-02-11 20:20:40
12586,99% cacao negro Hacendado,2.6,0.1,2026-02-11 20:04:39
42314,Abrillantador lavavajillas líquido Bosque Verde,1.2,0.75,2026-02-11 20:18:00
86652,Abrillantador lavavajillas líquido Finish,3.95,0.4,2026-02-11 20:18:02
13994,Abrillantador suelos Bosque Verde,2.5,1.0,2026-02-11 20:17:42
72878,Absorbeolores en gel para frigorífico Bosque Verde,1.8,1.0,2026-02-11 20:17:31
16831,Absorbeolores Ropa Limpia Bosque Verde,0.8,1.0,2026-02-11 20:17:31
79217,Aceite corporal aloe vera Deliplus,1.65,0.4,2026-02-11 20:13:02
46815,Aceite corporal de almendras Deliplus 100% natural,3.4,0.2,2026-02-11 20:13:03
46816,Aceite corporal de romero Deliplus 100% natural,3.2,0.2,2026-02-11 20:13:03
46831,Aceite corporal rosa mosqueta Deliplus,4.8,0.03,2026-02-11 20:13:04
4193,Aceite de coco virgen Hacendado,5.25,0.45,2026-02-11 20:01:49
4041,"Aceite de girasol refinado 0,2º Hacendado",8.45,5.0,2026-02-11 20:01:49
4040,"Aceite de girasol refinado 0,2º Hacendado",1.75,1.0,2026-02-11 20:01:49
4241,"Aceite de oliva 0,4º Hacendado",19.75,5.0,2026-02-11 20:01:43
4240,"Aceite de oliva 0,4º Hacendado",4.1,1.0,2026-02-11 20:01:43
4641,Aceite de oliva 1º Hacendado,20.85,5.0,2026-02-11 20:01:45
4640,Aceite de oliva 1º Hacendado,4.35,1.0,2026-02-11 20:01:45
4717,Aceite de oliva virgen extra Hacendado,14.55,3.0,2026-02-11 20:01:44
4740,Aceite de oliva virgen extra Hacendado,4.95,1.0,2026-02-11 20:01:44
4718,Aceite de oliva virgen extra Hacendado,2.7,0.2,2026-02-11 20:01:46
4706,Aceite de oliva virgen extra Hacendado Gran Selección,5.95,0.75,2026-02-11 20:01:45
4850,Aceite de oliva virgen extra Picual Casa Juncal,4.85,0.5,2026-02-11 20:01:47
4711,Aceite de oliva virgen Hacendado,12.85,3.0,2026-02-11 20:01:46
4749,Aceite de oliva virgen Hacendado,4.45,1.0,2026-02-11 20:01:46
52590,Aceite de Ricino Deliplus,3.45,0.03,2026-02-11 20:15:16
46844,Aceite en crema corporal oriental Deliplus,3.0,0.25,2026-02-11 20:13:03
8822,Aceite facial doble limpieza Facial Clean desmaquillante y limpiador,3.75,0.15,2026-02-11 20:13:21
19874,Aceite labial Lip Oil glow infusion Deliplus 01 nude,4.5,0.004,2025-12-20 07:38:02
19873,Aceite labial Lip Oil glow infusion Deliplus 02 cherry,4.5,0.004,2025-12-20 07:38:02
23017,Aceite árbol del té 100% puro Deliplus con pipeta dosificadora,3.0,0.01,2026-02-11 20:15:10
21756,Aceitunas negras de Aragón Campo Nature,2.5,0.2,2026-02-11 20:03:26
8309,Aceitunas negras en rodajas Hacendado,2.0,0.148,2026-02-11 20:03:26
52734,Aceitunas negras sin hueso Hacendado,1.05,0.35,2026-02-11 20:03:25
52733,Aceitunas negras sin hueso Hacendado,3.0,1.05,2026-02-11 20:03:26
33168,Aceitunas verdes Chupadedos Huerta de Barros partidas aliñadas,3.4,0.98,2026-02-11 20:03:22
33205,Aceitunas verdes con hueso Hacendado,1.5,0.43,2026-02-11 20:03:24
33120,Aceitunas verdes con hueso Hacendado sabor anchoa,2.95,0.935,2026-02-11 20:03:24
13422,Aceitunas verdes estilo casero Hacendado partidas aliñadas,2.95,0.94,2026-02-11 20:03:23
80177,Aceitunas verdes Gazpacha Hacendado partidas,2.5,0.835,2026-02-11 20:03:22
86100,Aceitunas verdes partidas Olives Garcia,3.9,0.815,2026-02-11 20:03:25
52622,Aceitunas verdes Picadedos sin hueso Hacendado aliñadas,3.8,0.71,2026-02-11 20:03:25
22910,Aceitunas verdes rellenas de anchoa Hacendado,3.0,1.05,2026-02-11 20:03:21
23217,Aceitunas verdes rellenas de anchoa Hacendado,1.8,0.36,2026-02-11 20:03:21
22911,Aceitunas verdes rellenas de anchoa Hacendado,1.05,0.35,2026-02-11 20:03:22
12764,Aceitunas verdes rellenas de anchoa Hacendado,3.35,0.83,2026-02-11 20:03:23
33078,Aceitunas verdes rellenas de anchoa Hacendado reducidas en sal,1.95,0.36,2025-12-02 07:21:20
33178,Aceitunas verdes rellenas de jalapeño Hacendado,1.75,0.35,2026-02-11 20:03:24
11946,Aceitunas verdes rellenas de pepinillo Hacendado,2.85,0.315,2026-02-11 20:03:25
23708,Aceitunas verdes rellenas de pimiento asado Hacendado,1.75,0.35,2026-02-09 07:56:24
33121,Aceitunas verdes sin hueso aliñadas Hacendado,1.9,0.42,2026-02-11 20:03:24
33053,Aceitunas verdes sin hueso Hacendado,2.8,0.81,2026-02-11 20:03:22
33114,Aceitunas verdes sin hueso Hacendado,1.7,0.525,2026-02-11 20:03:23
69698,Acelgas,2.15,0.8,2026-02-11 20:16:08
69725,Acelgas cortadas y lavadas,1.35,0.3,2026-02-11 20:16:05
16314,Acelgas troceadas Hacendado,1.75,0.66,2026-02-11 20:11:37
52933,Acondicionador instantáneo Hydra hyaluronic Deliplus cabello de normal a seco,2.0,0.25,2026-02-11 20:12:01
9970,Acondicionador instantáneo Kids Deliplus,1.7,0.25,2026-02-11 20:12:00
44326,Acondicionador instantáneo Repair & Nutrition Deliplus cabello seco y dañado,3.0,0.4,2026-02-11 20:12:00
7943,Acondicionador Liso Keratina TRESemmé cabello encrespado o dañado,2.95,0.35,2026-02-11 20:12:01
75532,Acondicionador Protector Color Vive Elvive cabello teñido o con mechas,3.4,0.25,2026-02-11 20:12:00
44363,Acondicionador Repair & Nutrition Deliplus cabello seco y dañado,1.4,0.3,2026-02-11 20:11:59
35615,Acondicionador Repara & Protege Pantene,4.0,0.25,2026-02-11 20:12:00
35420,Acondicionador Suavidad y Brillo Deliplus todo tipo de cabello,1.75,1.0,2026-02-11 20:11:59
40315,Activador Blanqueante ropa blanca Oxi Active Bosque Verde en polvo,3.1,1.0,2026-02-11 20:17:02
40230,Activador Blanqueante ropa blanca Oxi Active Bosque Verde líquido,1.75,2.0,2026-02-11 20:17:03
40317,Activador Quitamanchas ropa de color Oxi Active Bosque Verde en polvo,3.1,1.0,2026-02-11 20:17:02
40233,Activador Quitamanchas ropa de color Oxi Active Bosque Verde líquido,1.75,2.0,2026-02-11 20:17:02
28197,Agua de coco Hacendado 100%,1.35,0.33,2026-02-11 20:03:19
28198,Agua de coco Hacendado 100% natural,2.6,1.0,2026-02-11 20:03:19
35516,Agua de colonia bebé Nenuco,2.85,0.5,2026-02-11 20:05:17
14391,Agua de colonia Deliplus Citrus Classic,2.75,0.75,2026-02-11 20:14:54
14390,Agua de colonia Deliplus Floral Infusion,2.75,0.75,2026-02-11 20:14:55
8949,Agua de colonia fresca infantil Deliplus con notas cítricas,1.9,0.6,2026-02-11 20:05:17
90794,Agua de colonia para perros y gatos Krislin,4.0,0.25,2026-01-11 19:47:09
46204,Agua de colonia S3 Classic fresh,3.5,0.75,2026-02-11 20:14:44
11677,Agua de colonia S3 Mediterránea,3.5,0.75,2026-02-11 20:14:53
44313,Agua de peinado cabello Aqua Styling Deliplus,2.1,0.2,2026-02-11 20:12:49
27203,Agua de soda con sifón La Casa,1.6,1.5,2026-02-11 20:02:36
90505,Agua destilada Bosque Verde,0.9,2.0,2026-02-11 20:17:05
76465,Agua facial de avena Deliplus,2.9,0.3,2026-02-11 20:13:19
46954,Agua micelar cara y ojos Facial Clean,3.0,0.4,2026-02-11 20:13:17
27366,Agua mineral con gas grande Cortes,2.7,9.0,2026-02-11 20:02:34
27367,Agua mineral con gas grande Cortes,0.45,1.5,2026-02-11 20:02:35
27598,Agua mineral con gas grande Fonter,6.84,6.0,2026-02-11 20:02:36
27597,Agua mineral con gas grande Fonter,1.14,1.0,2026-02-11 20:02:37
27894,Agua mineral con gas grande San Pellegrino,8.34,6.0,2026-02-11 20:02:35
27893,Agua mineral con gas grande San Pellegrino,1.39,1.0,2026-02-11 20:02:36
27213,Agua mineral con gas grande Vichy Catalan,1.55,1.0,2026-02-11 20:02:34
27368,Agua mineral con gas pequeña Cortes,1.74,3.0,2026-02-11 20:02:35
27369,Agua mineral con gas pequeña Cortes,0.29,0.5,2026-02-11 20:02:35
28185,Agua mineral con gas pequeña Vichy Catalan,6.15,1.8,2026-02-11 20:02:34
27314,Agua mineral grande Bezoya,4.5,9.0,2026-02-11 20:02:30
27230,Agua mineral grande Bezoya,0.75,1.5,2026-02-11 20:02:31
28035,Agua mineral grande Bronchales,1.3,6.0,2026-02-11 20:02:25
23448,Agua mineral grande Bronchales,2.34,9.0,2026-02-11 20:02:25
23449,Agua mineral grande Bronchales,0.39,1.5,2026-02-11 20:02:25
28060,Agua mineral grande Cortes,0.95,8.0,2026-02-11 20:02:27
27088,Agua mineral grande Cortes,0.82,6.0,2026-02-11 20:02:28
28269,Agua mineral grande Cortes,1.62,9.0,2026-02-11 20:02:28
28270,Agua mineral grande Cortes,0.27,1.5,2026-02-11 20:02:28
27350,Agua mineral grande Font Vella,4.32,9.0,2026-02-11 20:02:32
27204,Agua mineral grande Font Vella,0.75,1.5,2026-02-11 20:02:32
27291,Agua mineral grande Lanjarón,4.2,9.0,2026-02-11 20:02:33
27216,Agua mineral grande Lanjarón,0.73,1.5,2026-02-11 20:02:33
27099,Agua mineral grande Nestlé Aquarel,3.84,9.0,2026-02-11 20:02:31
27232,Agua mineral grande Nestlé Aquarel,0.64,1.5,2026-02-11 20:02:31
27327,Agua mineral grande Solán de Cabras,5.34,9.0,2026-02-11 20:02:32
27356,Agua mineral grande Solán de Cabras,0.89,1.5,2026-02-11 20:02:32
28491,Agua mineral mediana Bronchales,3.0,6.0,2026-02-11 20:02:26
28499,Agua mineral mediana Bronchales,0.5,1.0,2026-02-11 20:02:26
28163,Agua mineral mediana Cortes,2.4,6.0,2026-02-11 20:02:28
28164,Agua mineral mediana Cortes,0.4,1.0,2026-02-11 20:02:29
27061,Agua mineral pequeña Bronchales,1.74,3.0,2026-02-11 20:02:26
27054,Agua mineral pequeña Bronchales,0.29,0.5,2026-02-11 20:02:27
28566,Agua mineral pequeña Bronchales tapón infantil,2.4,1.98,2026-02-11 20:02:27
28567,Agua mineral pequeña Bronchales tapón infantil,0.4,0.33,2026-02-11 20:02:27
27076,Agua mineral pequeña Cortes,1.56,3.0,2026-02-11 20:02:29
27078,Agua mineral pequeña Cortes,0.26,0.5,2026-02-11 20:02:30
28288,Agua mineral pequeña Cortes tapón infantil,1.68,1.98,2026-02-11 20:02:30
28296,Agua mineral pequeña Cortes tapón infantil,0.28,0.33,2026-02-11 20:02:30
77241,Agua oxigenada Deliplus desinfectante antiséptico,0.65,0.25,2026-02-11 20:15:18
44413,Agua para plancha Bosque Verde perfume ropa limpia,1.5,1.0,2026-02-11 20:17:06
46559,Agua perfumada bebé con notas florales Deliplus,3.2,0.1,2026-02-11 20:05:18
3830,Aguacate,1.14,0.22,2026-02-11 20:15:34
3858,Aguacates,3.58,0.73,2026-02-11 20:15:34
86656,Ajo granulado Hacendado,1.2,0.115,2026-02-11 20:01:59
69695,Ajo negro dientes pelados,5.0,0.085,2026-02-11 20:15:50
69632,Ajo tierno,2.6,0.2,2026-02-11 20:15:50
61288,Ajo tierno Hacendado ultracongelado,2.05,0.3,2026-02-11 20:11:03
61251,Ajo troceado Hacendado ultracongelado,1.04,0.15,2026-02-11 20:11:09
60873,Ajo y Perejil Hacendado,1.35,0.074,2026-02-11 20:01:56
33022,Ajos aliñados Hacendado,2.6,0.345,2026-02-11 20:03:29
69297,Ajos morados,1.85,0.25,2026-02-11 20:15:49
2784,Alas de pollo,4.05,0.91,2026-02-11 20:07:17
2832,Alas de pollo adobadas,3.53,0.63,2026-02-11 20:08:02
8970,Alas de pollo adobadas picantes,3.33,0.52,2026-02-11 20:07:22
52426,Alas de pollo barbacoa congeladas,3.7,0.75,2026-02-11 20:10:09
25184,Alas de pollo congeladas,3.6,1.0,2026-02-11 20:10:07
2785,Alas partidas de pollo,3.12,0.6,2026-02-11 20:07:15
3791,Alas partidas de pollo certificado alimentado con un 50% de maíz,4.03,0.64,2026-02-11 20:07:19
69287,Albahaca,1.55,0.02,2026-02-11 20:16:02
34128,Albahaca Hacendado,1.25,0.02,2026-02-11 20:01:54
63435,Albóndigas de bacalao Camós congeladas,2.1,0.4,2026-02-11 20:19:41
2871,Albóndigas de cerdo,4.55,0.84,2026-02-11 20:07:54
23632,Albóndigas de pollo,6.0,0.84,2026-02-11 20:07:54
23139,Albóndigas de pollo Hacendado,1.8,0.42,2026-02-11 20:22:31
23138,Albóndigas en salsa Hacendado,1.8,0.42,2026-02-11 20:22:29
4797,Albóndigas guisadas Hacendado,2.75,0.275,2026-02-11 20:22:24
69623,Alcachofa,0.5,0.17,2026-02-11 20:16:06
61205,Alcachofa baby Hacendado ultracongelada,3.05,0.3,2026-02-11 20:11:10
13865,Alcachofa troceada Hacendado ultracongelada,2.65,0.4,2026-02-11 20:11:03
33190,Alcaparras Hacendado,1.35,0.135,2026-02-11 20:03:28
77248,Alcohol 96º Deliplus antiséptico,0.75,0.25,2026-02-11 20:15:18
77322,Alcohol de romero Deliplus,2.0,0.25,2026-02-11 20:15:20
85716,Alfajor de almendra La Muralla,0.14,0.028,2025-12-23 07:43:25
12051,Algodón hidrófilo 100% zig-zag hipoalergénico Deliplus,1.2,0.1,2026-02-11 20:15:20
43705,Algodón mágico Aladdin,3.8,0.075,2026-02-11 20:17:57
90309,Alguicida sin espuma líquido Bosque Verde para piscina,12.5,5.0,2026-02-11 20:17:36
13559,Alicate uñas Deliplus,4.9,1.0,2026-02-11 20:14:43
38007,Alimento completo conejos enanos Granzoo,1.7,0.8,2026-02-11 20:20:37
38130,Alimento completo para canarios y jilgueros Granzoo,1.88,1.0,2026-02-11 20:20:36
38220,Alimento completo para loros y cotorras Granzoo,3.3,0.7,2026-02-11 20:20:36
13646,Alimento completo para ninfa y agaporni Granzoo,1.85,0.8,2026-02-11 20:20:37
38131,Alimento completo para periquitos Granzoo,1.9,1.0,2026-02-11 20:20:35
52765,"Alimento completo para roedores Granzoo hámster, cobaya y chinchilla",1.9,0.7,2026-02-11 20:20:37
60389,Alistado grande Hacendado congelado,34.5,0.5,2026-02-07 07:50:46
62704,Alistado mediano Hacendado ultracongelado,21.25,0.5,2026-02-11 20:19:28
24708,Alistado pequeño congelado,2227.5,,2026-02-11 20:19:27
24707,Alistado pequeño Hacendado congelado,24.94,1.16,2026-02-11 20:19:27
13705,Alitas de pollo asadas Hacendado,4.4,0.5,2026-02-11 20:22:23
17265,Aliño de aceite con perejil y ajo Hacendado,1.8,0.15,2026-02-11 20:02:22
17150,Allioli Chovi,1.55,0.18,2026-02-11 20:02:11
17173,Allioli en sobres individuales Hacendado,1.6,0.16,2026-02-11 20:02:11
17172,Allioli Hacendado,1.1,0.2,2026-02-11 20:02:11
60874,Almeja Hacendado congelada,1.8,0.45,2026-02-11 20:19:33
81418,Almeja japonesa,10.7,0.5,2026-01-16 19:53:38
18579,Almejas blancas del norte al natural Hacendado,1.65,0.185,2025-12-10 07:30:36
18552,Almejones al natural Hacendado,1.35,0.111,2026-02-11 20:11:26
34009,Almendra frita y salada Hacendado pelada,3.15,0.2,2026-02-11 20:03:35
34923,Almendra laminada Hacendado,2.15,0.125,2026-02-11 20:21:58
80492,Almendra marcona Hacendado frita con sal,2.95,0.125,2026-02-11 20:03:39
34921,Almendra molida Hacendado,2.15,0.125,2026-02-11 20:21:56
34865,Almendra natural Hacendado,2.5,0.2,2026-02-11 20:03:32
23575,Almendra natural Hacendado sin piel,2.9,0.2,2026-02-11 20:03:39
52928,Almendra palitos Hacendado,1.85,0.1,2026-02-11 20:21:58
34014,Almendra tostada Hacendado 0% sal añadida con piel,2.95,0.2,2026-02-11 20:03:36
11960,Almendra tostada y salada Hacendado con piel,2.4,0.2,2026-02-11 20:03:34
36421,Almendras rellenas de turrón Hacendado,2.9,0.15,2026-01-05 19:50:22
33136,Altramuces Hacendado,1.75,0.69,2026-02-11 20:03:28
5124,Alubia blanca Hacendado,2.45,1.0,2026-02-11 20:04:06
26019,Alubia cocida blanca Hacendado,0.8,0.57,2026-02-11 20:04:05
26028,Alubia cocida blanca Hacendado,0.7,0.295,2026-02-11 20:04:06
26002,Alubia cocida granja Hacendado,1.75,0.57,2026-02-11 20:04:07
26001,Alubia cocida pinta Hacendado,1.25,0.57,2026-02-11 20:04:06
26000,Alubia cocida roja Hacendado,1.2,0.57,2026-02-11 20:04:06
67608,Alubia negra Hacendado,2.5,1.0,2026-02-11 20:04:07
23453,Alubia pinta Hacendado,2.4,1.0,2026-02-11 20:04:08
67609,Alubia roja Hacendado,3.2,1.0,2026-02-11 20:04:07
26114,Alubias a la jardinera Hacendado,1.2,0.42,2026-02-11 20:22:30
26138,Alubias con tomate Heinz,1.5,0.415,2026-02-11 20:22:31
79425,Ambientador coche Bali Bosque Verde,1.85,1.0,2026-02-11 20:17:25
79447,Ambientador coche Exótico Bosque Verde,1.85,1.0,2026-02-11 20:17:26
79446,Ambientador coche Frutos Silvestres Bosque Verde,1.85,1.0,2026-02-11 20:17:25
79448,Ambientador coche Marine Bosque Verde,1.85,1.0,2026-02-11 20:17:26
43058,Ambientador lavavajillas Limón Bosque Verde,1.5,1.0,2026-02-11 20:18:01
72873,Ambientador líquido concentrado Foresan deluxe,1.7,0.125,2026-02-11 20:17:29
72734,Ambientador perlas Lima Bosque Verde,1.45,1.0,2026-02-11 20:17:28
72733,Ambientador perlas Tiernos Recuerdos Bosque Verde,1.45,1.0,2026-02-11 20:17:27
8876,Ambientador Spa armarios y cajones Bosque Verde,1.75,1.0,2026-02-11 20:17:28
60629,Ambientador spray Colonia Bosque Verde,1.15,0.3,2025-11-17 07:34:44
40159,Ambientador spray de tejidos Elixir Floral Bosque Verde,2.15,0.4,2026-02-11 20:17:19
14256,Ambientador spray Essence Bosque Verde,1.15,0.3,2026-02-11 20:17:20
60707,Ambientador spray Fresh Bosque Verde,1.15,0.3,2026-02-11 20:17:19
13040,Ambientador spray Red Elixir Bosque Verde,1.15,0.3,2026-02-11 20:17:20
72537,Ambientador spray Ropa Limpia Bosque Verde,1.15,0.3,2026-02-11 20:17:18
67997,Ambientador spray Sweet Blossom Bosque Verde,1.15,0.3,2026-02-11 20:17:19
13295,Ambientador Talco armarios y cajones Bosque Verde,1.75,1.0,2026-02-11 20:17:29
13788,Ambientador varitas Bambú Bosque Verde,2.1,0.04,2026-02-11 20:17:26
13789,Ambientador varitas Frambuesa Bosque Verde,2.1,0.04,2026-02-11 20:17:26
13780,Ambientador varitas Fruta Tropical Bosque Verde,2.1,0.04,2026-02-11 20:17:27
13055,Ambientador varitas Magnolia Bosque Verde,2.1,0.04,2026-02-11 20:17:27
13056,Ambientador varitas Pistacho Bosque Verde,2.1,0.04,2026-02-11 20:17:29
43802,Amoníaco con detergente Bosque Verde,0.95,1.5,2026-02-11 20:17:35
43813,Amoníaco muy fuerte Bosque Verde con detergente,1.25,0.75,2026-02-11 20:17:35
43818,Amoníaco perfumado Bosque Verde,0.75,1.5,2026-02-11 20:17:34
46885,Ampollas faciales spray flash Tensor Effect Deliplus Sisbela Reafirm,2.5,0.004,2025-12-10 07:33:04
50321,Ampollas faciales Ácido Hialurónico Hidrata Deliplus concentrado,3.5,0.014,2026-02-11 20:13:29
35614,Ampollas tratamiento intensivo Repara & Protege Pantene cabello dañado,4.35,0.045,2026-02-11 20:12:06
34027,Anacardo frito salado Hacendado,2.8,0.2,2026-02-11 20:03:34
23365,Anacardo natural Hacendado,2.8,0.2,2026-02-11 20:03:33
87254,Anguila troceada,9.74,0.33,2026-02-11 20:20:05
63163,Anillas de pota a la romana Hacendado ultracongeladas,5.25,0.5,2026-02-11 20:19:44
24249,Anillas de pota Argentina Hacendado congeladas,5.75,,2026-02-11 20:19:47
34123,Anís en grano Hacendado,2.0,0.05,2026-01-31 19:31:44
28397,Anís seco Cassalla Cerveró,11.75,1.0,2026-02-11 20:06:03
28334,Anís seco Limiñana,10.5,1.0,2026-02-11 20:06:04
28311,Anís seco Tenis,12.7,1.0,2026-02-11 20:06:03
28356,Aperitivo Aperol,13.65,0.7,2026-02-11 20:05:53
28494,Aperitivo de café Cerol,6.4,1.0,2026-02-11 20:05:54
8953,Aperitivo de patata con sabor a nata agria y cebolla,1.75,0.175,2026-02-11 20:03:52
33556,Aperitivo de patata sabor crema agria y cebolla Pringles,2.65,0.165,2026-02-11 20:03:51
33555,Aperitivo de patata sabor original Pringles,2.65,0.165,2026-02-11 20:03:50
69245,Apio cortado lavado,1.16,0.21,2026-02-11 20:16:07
69275,Apio verde,1.32,0.66,2026-02-11 20:16:07
35735,Apósitos hidrocoloides adhesivos para ampollas y rozaduras Deliplus surtidos,4.3,1.0,2026-02-11 20:15:22
7894,Apósitos infantiles Tattoo Deliplus,1.3,1.0,2025-12-26 07:32:48
40583,Arcos dentales para higiene interdental Deliplus,1.8,1.0,2026-02-11 20:14:15
13658,Arena para gato aglomerante Nuske perfumada,3.75,5.0,2026-02-11 20:20:19
90080,Arena para gato antibacterias Nuske,1.5,5.0,2026-02-11 20:20:19
90947,Arena para gato de perlas sílice Single,3.55,4.0,2026-02-11 20:20:19
63238,Aritos de surimi a la romana Hacendado ultracongelados,3.3,0.6,2026-02-11 20:19:41
23173,Aritos perro adulto y sénior Compy,8.3,4.0,2026-02-11 20:20:27
19816,Aroma agua de azahar Hacendado,2.0,0.15,2026-01-07 19:52:01
32524,Aroma de vainilla Hacendado,2.0,0.15,2026-02-11 20:21:07
15757,Aros de maíz Hacendado,0.85,0.12,2026-02-11 20:03:56
87786,Arreglo de marisco pelado,9.45,0.45,2026-02-11 20:19:26
3556,Arreglo para arroz al horno,6.0,0.76,2026-02-11 20:07:03
88180,Arreglo para paella con pollo y conejo,6.86,0.94,2026-02-11 20:07:05
3497,"Arreglo para puchero vacuno, cerdo y pollo",7.22,1.11,2026-02-11 20:07:03
52790,Arroz Albufera Hacendado,2.95,1.0,2026-02-11 20:04:01
5002,Arroz basmati aromático Hacendado,2.2,1.0,2026-02-11 20:04:02
5025,Arroz bomba Hacendado,5.1,1.0,2026-01-10 07:20:30
19866,Arroz campestre con pollo Hacendado ultracongelado,2.0,0.35,2026-02-11 20:10:04
22280,Arroz cocido basmati Sabroz,1.15,0.25,2026-02-11 20:22:20
22281,Arroz cocido integral Sabroz,1.1,0.25,2026-02-11 20:22:20
22279,Arroz cocido redondo Sabroz,1.1,0.25,2026-02-11 20:22:21
68354,Arroz con leche Hacendado,1.35,0.52,2026-02-11 20:22:51
12756,Arroz con verduras para microondas Hacendado ultracongelado,2.0,0.8,2026-02-11 20:10:03
20893,Arroz de pescado Hacendado,4.0,0.28,2026-02-11 20:22:22
22767,Arroz de secreto ibérico con setas Hacendado,3.0,0.28,2026-02-11 20:22:21
60621,Arroz de verduras Hacendado,3.5,0.28,2026-02-11 20:22:22
5184,Arroz integral largo Hacendado,1.65,1.0,2026-02-11 20:04:03
5063,Arroz largo Hacendado,1.35,1.0,2026-02-11 20:04:00
12972,Arroz largo Sabroz,1.1,0.25,2026-02-11 20:04:03
12782,Arroz marinera Hacendado ultracongelado,2.2,0.35,2026-02-11 20:10:04
35541,Arroz negro Hacendado ultracongelado,3.0,0.6,2026-02-11 20:10:03
61302,Arroz para microondas Hacendado ultracongelado,2.0,1.0,2026-02-11 20:10:03
5044,Arroz redondo Hacendado,1.3,1.0,2026-02-11 20:04:00
5042,Arroz redondo J Sendra Hacendado,1.6,1.0,2026-02-11 20:04:02
5000,Arroz redondo La Fallera,1.69,1.0,2026-02-11 20:04:00
52637,Arroz redondo Sabor,2.45,1.0,2026-02-11 20:04:03
86905,Arroz tres delicias Hacendado ultracongelado,2.85,1.0,2026-02-11 20:10:02
5020,Arroz vaporizado Hacendado,1.65,1.0,2026-02-11 20:04:02
5501,Arándanos,3.35,0.225,2026-02-11 20:15:37
5507,Arándanos,6.5,0.5,2026-02-11 20:15:38
34605,Arándanos deshidratados Hacendado,2.2,0.2,2026-02-11 20:03:47
61093,Arándanos enteros Hacendado ultracongelados,2.15,0.3,2026-02-11 20:10:59
18018,Atún claro al natural Hacendado,4.2,0.48,2026-02-11 20:11:18
18055,Atún claro en aceite de girasol Hacendado,4.3,0.48,2026-02-11 20:11:17
18092,Atún claro en aceite de girasol Hacendado,2.7,0.24,2026-02-11 20:11:17
18002,Atún claro en aceite de oliva Hacendado,4.9,0.48,2026-02-11 20:11:17
18071,Atún claro en aceite de oliva Hacendado,1.55,0.111,2026-02-11 20:11:18
18054,Atún claro en aceite de oliva Hacendado,3.7,0.195,2026-02-11 20:11:19
18031,Atún claro en escabeche blanco Hacendado,4.7,0.48,2026-02-11 20:11:18
18086,Atún en aceite de girasol Hacendado,6.5,0.9,2026-02-11 20:11:16
18030,Atún en aceite de oliva Hacendado,7.7,0.9,2026-02-11 20:11:17
18037,Atún en salsa de tomate Hacendado,2.1,0.24,2026-02-11 20:11:19
34164,Avellana natural Hacendado,3.25,0.2,2025-11-22 07:18:20
34025,Avellana tostada Hacendado 0% sal añadida,5.3,0.2,2026-02-11 20:03:34
16807,Avena molida Hacendado,1.15,0.5,2026-02-11 20:08:13
8370,Azafrán hebra Hacendado,1.95,0.0004,2026-02-11 20:01:57
34116,Azafrán molido Hacendado,1.9,0.0004,2026-02-11 20:01:57
19837,Azúcar blanco en sobres Hacendado,1.55,0.35,2026-02-11 20:04:24
19897,Azúcar blanco Hacendado,1.0,1.0,2026-02-11 20:04:24
35649,Azúcar glas Hacendado,2.6,0.5,2026-02-11 20:04:25
22349,Azúcar moreno de caña Hacendado,1.9,1.0,2026-02-11 20:04:25
19832,Azúcar moreno en sobres Hacendado,1.75,0.35,2026-02-11 20:04:25
32525,Azúcar vainillado Hacendado,1.3,0.12,2026-02-11 20:21:57
81204.1,Bacalao a rodajas,25.08,1.9,2026-02-11 20:19:57
81204.2,Bacalao abierto en libro sin cabeza y sin espina,25.08,1.9,2026-02-11 20:19:57
13787,Bacalao ahumado Hacendado en aceite de girasol,4.45,0.11,2026-02-11 20:20:09
87211,Bacalao al punto de sal descongelado,9.0,0.45,2026-02-11 20:19:58
81204.3,Bacalao media pieza a rodajas,13.99,1.06,2026-02-11 20:19:57
81204.4,Bacalao media pieza abierto en libro sin cabeza y sin espina,13.99,1.06,2026-02-11 20:19:58
59163,Bacón ahumado La Selva lonchas,2.3,0.21,2026-02-11 20:08:51
59160,Bacón ahumado sin corteza La Selva,3.0,0.3,2026-02-11 20:08:52
59066,Bacón Hacendado cintas,2.3,0.25,2026-02-11 20:08:51
53500,Bacón Oscar Mayer lonchas,2.4,0.15,2026-02-11 20:08:51
5827,Baguette,0.57,0.25,2025-11-25 07:38:19
83230,Baguette masa madre,0.57,0.25,2026-02-11 20:21:13
82753,Baguette sin gluten,1.95,0.175,2026-02-11 20:21:13
3824,Banana,0.29,0.19,2026-02-11 20:15:26
79673,Bandas adhesivas fijación fuerte color beige Deliplus para cortar,1.5,1.0,2026-02-11 20:15:19
74081,Bandas de cera especial piernas Deliplus piel sensible,1.4,1.0,2026-02-11 20:13:32
74079,Bandas de cera facial Deliplus piel sensible,1.1,1.0,2026-02-11 20:13:31
49632,Bandeja de cartón rectangular Bosque Verde,2.35,4.0,2026-02-11 20:18:13
11611,Bandeja oro Navidad Bosque Verde,1.8,5.0,2025-12-29 07:41:40
