id,name,last_price,unit_size,last_update
84397,10 Pasteles de boniato 57%,3.9,0.37,2025-12-12 07:42:23
84815,10 Pasteles de cabello de Ángel 57%,3.9,0.37,2025-12-12 07:42:23
5841,11 Panecillos,1.14,0.495,2025-12-12 07:43:10
84629,12 Mini croissants de mantequilla,2.15,0.24,2025-12-12 07:42:17
84638,12 Mini saladas surtidas,1.25,0.195,2025-12-12 07:42:25
60354,2 Panes integrales 100% fino,1.4,0.165,2025-12-12 07:43:12
84597,24 Mini saladas surtidas,2.5,0.39,2025-12-12 07:42:26
83203.1,3 Barras de pan,1.19,0.75,2025-12-12 07:43:03
83232.1,3 Barras de pan aceite de oliva,1.51,0.6,2025-12-12 07:43:04
83232.2,3 Barras de pan aceite de oliva rebanadas,1.51,0.6,2025-12-12 07:43:14
83203.2,3 Barras de pan rebanadas,1.19,0.75,2025-12-12 07:43:13
9664,3 Bocadillos,1.04,0.39,2025-12-12 07:43:07
12985,3 Susos relleno de crema,1.65,0.153,2025-12-12 07:42:22
69737,3 Vegetales para microondas lavados,1.85,0.3,2025-12-12 07:36:57
6459,4 Panes chapata de cristal,1.3,0.284,2025-12-12 07:43:08
5850,4 Panes de cristal redondos cortados 100 % natural,1.84,0.24,2025-12-12 07:43:12
83452,5 Barras de pan 51% integral,1.36,0.625,2025-12-12 07:43:08
84688,6 Croissant rellenos de cacao,1.75,0.28,2025-12-12 07:42:17
84676,6 Mini empanadillas de pisto,1.75,0.2,2025-12-12 07:42:26
22388,6 Panecillos integrales 100%,1.05,0.27,2025-12-12 07:43:11
83056,6 Panes de centeno 51%,1.47,0.465,2025-12-12 07:43:10
14431,6 Panes de leche 3%,1.51,0.48,2025-12-12 07:43:09
83292,6 Panes pulguitas sin aditivos,1.04,0.24,2025-12-12 07:43:09
43861,70% Alcohol de Limpieza Perfumado Bosque Verde,2.3,1.0,2025-12-12 07:38:59
43112,70% Alcohol limpieza hogar Bosque Verde,2.6,0.75,2025-12-12 07:39:01
84937,8 Croissants surtidos rellenos de crema de cacao y crema con leche sabor a chocolate blanco,2.55,0.3,2025-12-12 07:42:23
84684,8 Magdalenas con azúcar,2.7,0.38,2025-12-12 07:42:19
84900,8 Magdalenas con pepitas de chocolate,3.1,0.38,2025-12-12 07:42:19
12586,99% cacao negro Hacendado,2.7,0.1,2025-12-12 07:23:23
42314,Abrillantador lavavajillas líquido Bosque Verde,1.2,0.75,2025-12-12 07:39:04
86652,Abrillantador lavavajillas líquido Finish,3.95,0.4,2025-12-12 07:39:06
13994,Abrillantador suelos Bosque Verde,2.5,1.0,2025-12-12 07:38:43
72878,Absorbeolores en gel para frigorífico Bosque Verde,1.8,1.0,2025-12-12 07:38:30
16831,Absorbeolores Ropa Limpia Bosque Verde,0.8,1.0,2025-12-12 07:38:30
79217,Aceite corporal aloe vera Deliplus,1.65,0.4,2025-12-12 07:33:09
46815,Aceite corporal de almendras Deliplus 100% natural,3.4,0.2,2025-12-12 07:33:10
46816,Aceite corporal de romero Deliplus 100% natural,3.2,0.2,2025-12-12 07:33:10
46831,Aceite corporal rosa mosqueta Deliplus,4.8,0.03,2025-12-12 07:33:10
4193,Aceite de coco virgen Hacendado,5.45,0.45,2025-12-12 07:19:57
4041,"Aceite de girasol refinado 0,2º Hacendado",8.45,5.0,2025-12-12 07:19:56
4040,"Aceite de girasol refinado 0,2º Hacendado",1.75,1.0,2025-12-12 07:19:57
4241,"Aceite de oliva 0,4º Hacendado",18.75,5.0,2025-12-12 07:19:50
4240,"Aceite de oliva 0,4º Hacendado",3.85,1.0,2025-12-12 07:19:50
4641,Aceite de oliva 1º Hacendado,19.45,5.0,2025-12-12 07:19:51
4640,Aceite de oliva 1º Hacendado,4.0,1.0,2025-12-12 07:19:52
4717,Aceite de oliva virgen extra Hacendado,13.7,3.0,2025-12-12 07:19:50
4740,Aceite de oliva virgen extra Hacendado,4.65,1.0,2025-12-12 07:19:51
4718,Aceite de oliva virgen extra Hacendado,2.8,0.2,2025-12-12 07:19:53
4706,Aceite de oliva virgen extra Hacendado Gran Selección,5.95,0.75,2025-12-12 07:19:51
4850,Aceite de oliva virgen extra Picual Casa Juncal,4.95,0.5,2025-12-12 07:19:53
4711,Aceite de oliva virgen Hacendado,11.75,3.0,2025-12-12 07:19:52
4749,Aceite de oliva virgen Hacendado,4.1,1.0,2025-12-12 07:19:52
52590,Aceite de Ricino Deliplus,3.45,0.03,2025-12-12 07:35:51
46844,Aceite en crema corporal oriental Deliplus,3.0,0.25,2025-12-12 07:33:09
8822,Aceite facial doble limpieza Facial Clean desmaquillante y limpiador,3.75,0.15,2025-12-12 07:33:32
19874,Aceite labial Lip Oil glow infusion Deliplus 01 nude,4.5,0.004,2025-12-12 07:40:26
19873,Aceite labial Lip Oil glow infusion Deliplus 02 cherry,4.5,0.004,2025-12-12 07:40:26
23017,Aceite árbol del té 100% puro Deliplus con pipeta dosificadora,3.0,0.01,2025-12-12 07:35:44
21756,Aceitunas negras de Aragón Campo Nature,2.5,0.2,2025-12-12 07:21:51
8309,Aceitunas negras en rodajas Hacendado,2.0,0.148,2025-12-12 07:21:52
52734,Aceitunas negras sin hueso Hacendado,1.05,0.35,2025-12-12 07:21:51
52733,Aceitunas negras sin hueso Hacendado,3.0,0.35,2025-12-12 07:21:51
33168,Aceitunas verdes Chupadedos Huerta de Barros partidas aliñadas,3.4,0.98,2025-12-12 07:21:46
33205,Aceitunas verdes con hueso Hacendado,1.5,0.43,2025-12-12 07:21:49
33120,Aceitunas verdes con hueso Hacendado sabor anchoa,2.95,0.935,2025-12-12 07:21:49
13422,Aceitunas verdes estilo casero Hacendado partidas aliñadas,2.95,0.94,2025-12-12 07:21:48
80177,Aceitunas verdes Gazpacha Hacendado partidas,2.5,0.835,2025-12-12 07:21:47
86100,Aceitunas verdes partidas Olives Garcia,3.9,0.815,2025-12-12 07:21:50
52622,Aceitunas verdes Picadedos sin hueso Hacendado aliñadas,3.8,0.71,2025-12-12 07:21:50
22910,Aceitunas verdes rellenas de anchoa Hacendado,3.15,1.05,2025-12-12 07:21:45
23217,Aceitunas verdes rellenas de anchoa Hacendado,1.75,0.36,2025-12-12 07:21:45
22911,Aceitunas verdes rellenas de anchoa Hacendado,1.05,0.35,2025-12-12 07:21:46
12764,Aceitunas verdes rellenas de anchoa Hacendado,3.25,0.83,2025-12-12 07:21:47
33078,Aceitunas verdes rellenas de anchoa Hacendado reducidas en sal,1.95,0.36,2025-12-02 07:21:20
33178,Aceitunas verdes rellenas de jalapeño Hacendado,1.75,0.35,2025-12-12 07:21:48
11946,Aceitunas verdes rellenas de pepinillo Hacendado,2.85,0.315,2025-12-12 07:21:50
23708,Aceitunas verdes rellenas de pimiento asado Hacendado,1.75,0.35,2025-12-12 07:21:49
33121,Aceitunas verdes sin hueso aliñadas Hacendado,1.9,0.42,2025-12-12 07:21:48
33053,Aceitunas verdes sin hueso Hacendado,2.8,0.835,2025-12-12 07:21:46
33114,Aceitunas verdes sin hueso Hacendado,1.7,0.525,2025-12-12 07:21:47
69698,Acelgas,2.15,0.8,2025-12-12 07:36:53
69725,Acelgas cortadas y lavadas,1.35,0.3,2025-12-12 07:36:50
16314,Acelgas troceadas Hacendado,1.75,0.66,2025-12-12 07:31:31
52933,Acondicionador instantáneo Hydra hyaluronic Deliplus cabello de normal a seco,2.0,0.25,2025-12-12 07:31:57
9970,Acondicionador instantáneo Kids Deliplus,1.7,0.25,2025-12-12 07:31:56
44326,Acondicionador instantáneo Repair & Nutrition Deliplus cabello seco y dañado,3.0,0.4,2025-12-12 07:31:56
7943,Acondicionador Liso Keratina TRESemmé cabello encrespado o dañado,2.95,0.35,2025-12-12 07:31:58
75532,Acondicionador Protector Color Vive Elvive cabello teñido o con mechas,3.4,0.25,2025-12-12 07:31:57
44363,Acondicionador Repair & Nutrition Deliplus cabello seco y dañado,1.4,0.3,2025-12-12 07:31:56
35615,Acondicionador Repara & Protege Pantene,4.0,0.25,2025-12-12 07:31:57
35420,Acondicionador Suavidad y Brillo Deliplus todo tipo de cabello,1.75,1.0,2025-12-12 07:31:55
40315,Activador Blanqueante ropa blanca Oxi Active Bosque Verde en polvo,3.1,1.0,2025-12-12 07:37:57
40230,Activador Blanqueante ropa blanca Oxi Active Bosque Verde líquido,1.75,2.0,2025-12-12 07:37:58
40317,Activador Quitamanchas ropa de color Oxi Active Bosque Verde en polvo,3.1,1.0,2025-12-12 07:37:57
40233,Activador Quitamanchas ropa de color Oxi Active Bosque Verde líquido,1.75,2.0,2025-12-12 07:37:57
28198,Agua de coco Hacendado 100% natural,2.6,1.0,2025-12-12 07:21:43
35516,Agua de colonia bebé Nenuco,2.85,0.5,2025-12-12 07:24:21
14391,Agua de colonia Deliplus Citrus Classic,2.75,0.75,2025-12-12 07:35:21
14390,Agua de colonia Deliplus Floral Infusion,2.75,0.75,2025-12-12 07:35:22
8949,Agua de colonia fresca infantil Deliplus con notas cítricas,1.9,0.6,2025-12-12 07:24:21
90794,Agua de colonia para perros y gatos Krislin,4.0,0.25,2025-12-12 07:42:11
46204,Agua de colonia S3 Classic fresh,3.5,0.75,2025-12-12 07:35:09
11677,Agua de colonia S3 Mediterránea,3.5,0.75,2025-12-12 07:35:19
44313,Agua de peinado cabello Aqua Styling Deliplus,2.1,0.2,2025-12-12 07:32:53
27203,Agua de soda con sifón La Casa,1.6,1.5,2025-12-12 07:20:51
90505,Agua destilada Bosque Verde,0.9,2.0,2025-12-12 07:38:01
76465,Agua facial de avena Deliplus,2.9,0.3,2025-12-12 07:33:29
46954,Agua micelar cara y ojos Facial Clean,3.0,0.4,2025-12-12 07:33:26
27366,Agua mineral con gas grande Cortes,2.58,9.0,2025-12-12 07:20:49
27367,Agua mineral con gas grande Cortes,0.43,1.5,2025-12-12 07:20:49
27598,Agua mineral con gas grande Fonter,6.84,6.0,2025-12-12 07:20:51
27597,Agua mineral con gas grande Fonter,1.14,1.0,2025-12-12 07:20:51
27894,Agua mineral con gas grande San Pellegrino,8.34,6.0,2025-12-12 07:20:50
27893,Agua mineral con gas grande San Pellegrino,1.39,1.0,2025-12-12 07:20:50
27213,Agua mineral con gas grande Vichy Catalan,1.49,1.0,2025-12-12 07:20:48
27368,Agua mineral con gas pequeña Cortes,1.74,3.0,2025-12-12 07:20:49
27369,Agua mineral con gas pequeña Cortes,0.29,0.5,2025-12-12 07:20:50
28185,Agua mineral con gas pequeña Vichy Catalan,5.89,1.8,2025-12-12 07:20:48
27314,Agua mineral grande Bezoya,4.14,9.0,2025-12-12 07:20:45
27230,Agua mineral grande Bezoya,0.69,1.5,2025-12-12 07:20:45
28035,Agua mineral grande Bronchales,1.28,6.0,2025-12-12 07:20:39
23448,Agua mineral grande Bronchales,2.34,9.0,2025-12-12 07:20:39
23449,Agua mineral grande Bronchales,0.39,1.5,2025-12-12 07:20:39
28060,Agua mineral grande Cortes,0.92,8.0,2025-12-12 07:20:41
27088,Agua mineral grande Cortes,0.79,6.0,2025-12-12 07:20:42
28269,Agua mineral grande Cortes,1.5,9.0,2025-12-12 07:20:42
28270,Agua mineral grande Cortes,0.25,1.5,2025-12-12 07:20:42
27350,Agua mineral grande Font Vella,4.32,9.0,2025-12-12 07:20:46
27204,Agua mineral grande Font Vella,0.75,1.5,2025-12-12 07:20:46
27291,Agua mineral grande Lanjarón,4.2,9.0,2025-12-12 07:20:47
27216,Agua mineral grande Lanjarón,0.73,1.5,2025-12-12 07:20:48
27099,Agua mineral grande Nestlé Aquarel,3.72,9.0,2025-12-12 07:20:45
27232,Agua mineral grande Nestlé Aquarel,0.62,1.5,2025-12-12 07:20:46
27327,Agua mineral grande Solán de Cabras,5.34,9.0,2025-12-12 07:20:47
27356,Agua mineral grande Solán de Cabras,0.89,1.5,2025-12-12 07:20:47
28491,Agua mineral mediana Bronchales,3.0,6.0,2025-12-12 07:20:40
28499,Agua mineral mediana Bronchales,0.5,1.0,2025-12-12 07:20:40
28163,Agua mineral mediana Cortes,2.4,6.0,2025-12-12 07:20:43
28164,Agua mineral mediana Cortes,0.4,1.0,2025-12-12 07:20:43
27061,Agua mineral pequeña Bronchales,1.74,3.0,2025-12-12 07:20:40
27054,Agua mineral pequeña Bronchales,0.29,0.5,2025-12-12 07:20:41
28566,Agua mineral pequeña Bronchales tapón infantil,2.4,1.98,2025-12-12 07:20:41
28567,Agua mineral pequeña Bronchales tapón infantil,0.4,0.33,2025-12-12 07:20:41
27076,Agua mineral pequeña Cortes,1.44,3.0,2025-12-12 07:20:43
27078,Agua mineral pequeña Cortes,0.24,0.5,2025-12-12 07:20:44
28288,Agua mineral pequeña Cortes tapón infantil,1.56,1.98,2025-12-12 07:20:44
28296,Agua mineral pequeña Cortes tapón infantil,0.26,0.33,2025-12-12 07:20:44
77241,Agua oxigenada Deliplus desinfectante antiséptico,0.65,0.25,2025-12-12 07:35:53
44413,Agua para plancha Bosque Verde perfume ropa limpia,1.5,1.0,2025-12-12 07:38:01
46559,Agua perfumada bebé con notas florales Deliplus,3.2,0.1,2025-12-12 07:24:21
3830,Aguacate,0.95,0.17,2025-12-12 07:36:13
3858,Aguacates,3.87,0.73,2025-12-12 07:36:13
86656,Ajo granulado Hacendado,1.2,0.115,2025-12-12 07:20:08
69695,Ajo negro dientes pelados,5.0,0.085,2025-12-12 07:36:33
69632,Ajo tierno,2.55,0.2,2025-12-12 07:36:32
61288,Ajo tierno Hacendado ultracongelado,2.05,0.3,2025-12-12 07:30:55
61251,Ajo troceado Hacendado ultracongelado,1.04,0.15,2025-12-12 07:31:01
60873,Ajo y Perejil Hacendado,1.35,0.074,2025-12-12 07:20:04
33022,Ajos aliñados Hacendado,2.6,0.345,2025-12-12 07:21:55
69297,Ajos morados,1.85,0.25,2025-12-12 07:36:32
2784,Alas de pollo,4.05,0.91,2025-12-12 07:26:34
2832,Alas de pollo adobadas,3.53,0.63,2025-12-12 07:27:22
8970,Alas de pollo adobadas picantes,3.02,0.52,2025-12-12 07:26:39
52426,Alas de pollo barbacoa congeladas,3.7,0.75,2025-12-12 07:29:53
25184,Alas de pollo congeladas,3.6,1.0,2025-12-12 07:29:50
2785,Alas partidas de pollo,3.12,0.6,2025-12-12 07:26:31
3791,Alas partidas de pollo certificado alimentado con un 50% de maíz,4.03,0.64,2025-12-12 07:26:36
69287,Albahaca,1.55,0.02,2025-12-12 07:36:47
34128,Albahaca Hacendado,1.25,0.02,2025-12-12 07:20:03
63435,Albóndigas de bacalao Camós congeladas,2.1,0.4,2025-12-12 07:41:14
2871,Albóndigas de cerdo,4.55,0.84,2025-12-12 07:27:12
23632,Albóndigas de pollo,6.0,0.84,2025-12-12 07:27:12
23139,Albóndigas de pollo Hacendado,1.8,0.42,2025-12-12 07:44:46
23138,Albóndigas en salsa Hacendado,1.8,0.42,2025-12-12 07:44:45
4797,Albóndigas guisadas Hacendado,2.75,0.275,2025-12-12 07:44:38
69623,Alcachofa,0.86,0.18,2025-12-12 07:36:51
61205,Alcachofa baby Hacendado ultracongelada,3.05,0.3,2025-12-12 07:31:01
13865,Alcachofa troceada Hacendado ultracongelada,2.65,0.4,2025-12-12 07:30:55
33190,Alcaparras Hacendado,1.35,0.135,2025-12-12 07:21:54
77248,Alcohol 96º Deliplus antiséptico,0.75,0.25,2025-12-12 07:35:52
77322,Alcohol de romero Deliplus,2.0,0.25,2025-12-12 07:35:55
85716,Alfajor de almendra La Muralla,0.17,0.028,2025-12-12 07:42:47
12051,Algodón hidrófilo 100% zig-zag hipoalergénico Deliplus,1.2,0.1,2025-12-12 07:35:55
43705,Algodón mágico Aladdin,3.8,0.075,2025-12-12 07:39:00
90309,Alguicida sin espuma líquido Bosque Verde para piscina,12.5,5.0,2025-12-12 07:38:36
13559,Alicate uñas Deliplus,4.9,1.0,2025-12-12 07:35:08
38007,Alimento completo conejos enanos Granzoo,1.7,0.8,2025-12-12 07:42:15
38130,Alimento completo para canarios y jilgueros Granzoo,1.88,1.0,2025-12-12 07:42:14
38220,Alimento completo para loros y cotorras Granzoo,3.3,0.7,2025-12-12 07:42:15
13646,Alimento completo para ninfa y agaporni Granzoo,1.85,0.8,2025-12-12 07:42:15
38131,Alimento completo para periquitos Granzoo,1.9,1.0,2025-12-12 07:42:13
52765,"Alimento completo para roedores Granzoo hámster, cobaya y chinchilla",1.9,0.7,2025-12-12 07:42:16
60389,Alistado grande Hacendado congelado,34.5,0.5,2025-12-12 07:40:57
62704,Alistado mediano Hacendado ultracongelado,21.25,0.5,2025-12-12 07:40:57
24708,Alistado pequeño congelado,2227.5,,2025-12-12 07:40:56
24707,Alistado pequeño Hacendado congelado,24.94,1.16,2025-12-12 07:40:57
13705,Alitas de pollo asadas Hacendado,4.4,0.5,2025-12-12 07:44:37
17265,Aliño de aceite con perejil y ajo Hacendado,1.75,0.15,2025-12-12 07:20:36
17150,Allioli Chovi,1.45,0.18,2025-12-12 07:20:23
17173,Allioli en sobres individuales Hacendado,1.5,0.16,2025-12-12 07:20:24
17172,Allioli Hacendado,1.1,0.2,2025-12-12 07:20:24
60874,Almeja Hacendado congelada,1.7,0.45,2025-12-12 07:41:04
81418,Almeja japonesa,10.7,0.5,2025-12-12 07:41:04
18579,Almejas blancas del norte al natural Hacendado,1.65,0.185,2025-12-10 07:30:36
18552,Almejones al natural Hacendado,1.35,0.111,2025-12-12 07:31:18
34009,Almendra frita y salada Hacendado pelada,3.15,0.2,2025-12-12 07:22:03
80492,Almendra marcona Hacendado frita con sal,2.95,0.125,2025-12-12 07:22:07
34921,Almendra molida Hacendado,2.15,0.125,2025-12-12 07:44:00
34865,Almendra natural Hacendado,2.5,0.2,2025-12-12 07:21:59
23575,Almendra natural Hacendado sin piel,3.05,0.2,2025-12-12 07:22:07
52928,Almendra palitos Hacendado,1.85,0.1,2025-12-12 07:44:02
34014,Almendra tostada Hacendado 0% sal añadida con piel,2.95,0.2,2025-12-12 07:22:03
11960,Almendra tostada y salada Hacendado con piel,2.4,0.2,2025-12-12 07:22:02
36421,Almendras rellenas de turrón Hacendado,2.9,0.15,2025-12-12 07:42:48
33136,Altramuces Hacendado,1.75,0.69,2025-12-12 07:21:54
5124,Alubia blanca Hacendado,2.45,1.0,2025-12-12 07:22:43
26019,Alubia cocida blanca Hacendado,0.8,0.57,2025-12-12 07:22:42
26028,Alubia cocida blanca Hacendado,0.7,0.295,2025-12-12 07:22:42
26002,Alubia cocida granja Hacendado,1.75,0.57,2025-12-12 07:22:44
26001,Alubia cocida pinta Hacendado,1.25,0.57,2025-12-12 07:22:43
26000,Alubia cocida roja Hacendado,1.25,0.57,2025-12-12 07:22:42
67608,Alubia negra Hacendado,2.5,1.0,2025-12-12 07:22:43
23453,Alubia pinta Hacendado,2.4,1.0,2025-12-12 07:22:44
67609,Alubia roja Hacendado,3.2,1.0,2025-12-12 07:22:43
26114,Alubias a la jardinera Hacendado,1.2,0.42,2025-12-12 07:44:45
26138,Alubias con tomate Heinz,1.5,0.415,2025-12-12 07:44:47
79425,Ambientador coche Bali Bosque Verde,1.85,1.0,2025-12-12 07:38:23
79447,Ambientador coche Exótico Bosque Verde,1.85,1.0,2025-12-12 07:38:24
79446,Ambientador coche Frutos Silvestres Bosque Verde,1.85,1.0,2025-12-12 07:38:24
79448,Ambientador coche Marine Bosque Verde,1.85,1.0,2025-12-12 07:38:24
43058,Ambientador lavavajillas Limón Bosque Verde,1.5,1.0,2025-12-12 07:39:06
72873,Ambientador líquido concentrado Foresan deluxe,1.7,0.125,2025-12-12 07:38:27
72734,Ambientador perlas Lima Bosque Verde,1.45,1.0,2025-12-12 07:38:26
72733,Ambientador perlas Tiernos Recuerdos Bosque Verde,1.45,1.0,2025-12-12 07:38:26
8876,Ambientador Spa armarios y cajones Bosque Verde,1.75,1.0,2025-12-12 07:38:27
60629,Ambientador spray Colonia Bosque Verde,1.15,0.3,2025-11-17 07:34:44
40159,Ambientador spray de tejidos Elixir Floral Bosque Verde,2.15,0.4,2025-12-12 07:38:17
14256,Ambientador spray Essence Bosque Verde,1.15,0.3,2025-12-12 07:38:18
60707,Ambientador spray Fresh Bosque Verde,1.15,0.3,2025-12-12 07:38:16
13040,Ambientador spray Red Elixir Bosque Verde,1.15,0.3,2025-12-12 07:38:18
72537,Ambientador spray Ropa Limpia Bosque Verde,1.15,0.3,2025-12-12 07:38:16
67997,Ambientador spray Sweet Blossom Bosque Verde,1.15,0.3,2025-12-12 07:38:16
13295,Ambientador Talco armarios y cajones Bosque Verde,1.75,1.0,2025-12-12 07:38:28
13788,Ambientador varitas Bambú Bosque Verde,2.1,0.04,2025-12-12 07:38:25
13789,Ambientador varitas Frambuesa Bosque Verde,2.1,0.04,2025-12-12 07:38:25
13780,Ambientador varitas Fruta Tropical Bosque Verde,2.1,0.04,2025-12-12 07:38:25
13055,Ambientador varitas Magnolia Bosque Verde,2.1,0.04,2025-12-12 07:38:25
13056,Ambientador varitas Pistacho Bosque Verde,2.1,0.04,2025-12-12 07:38:28
43802,Amoníaco con detergente Bosque Verde,0.95,1.5,2025-12-12 07:38:34
43813,Amoníaco muy fuerte Bosque Verde con detergente,1.25,0.75,2025-12-12 07:38:35
43818,Amoníaco perfumado Bosque Verde,0.75,1.5,2025-12-12 07:38:34
46885,Ampollas faciales spray flash Tensor Effect Deliplus Sisbela Reafirm,2.5,0.004,2025-12-10 07:33:04
50321,Ampollas faciales Ácido Hialurónico Hidrata Deliplus concentrado,3.5,0.014,2025-12-12 07:33:41
35614,Ampollas tratamiento intensivo Repara & Protege Pantene cabello dañado,4.35,0.045,2025-12-12 07:32:03
34027,Anacardo frito salado Hacendado,2.8,0.2,2025-12-12 07:22:01
23365,Anacardo natural Hacendado,2.8,0.2,2025-12-12 07:22:00
87254,Anguila troceada,9.74,0.33,2025-12-12 07:41:41
63163,Anillas de pota a la romana Hacendado ultracongeladas,5.25,0.5,2025-12-12 07:41:17
24249,Anillas de pota Argentina Hacendado congeladas,5.75,,2025-12-12 07:41:20
34123,Anís en grano Hacendado,2.0,0.05,2025-12-12 07:20:14
28397,Anís seco Cassalla Cerveró,11.75,1.0,2025-12-12 07:25:10
28334,Anís seco Limiñana,10.2,1.0,2025-12-12 07:25:11
28311,Anís seco Tenis,12.3,1.0,2025-12-12 07:25:10
28356,Aperitivo Aperol,13.65,0.7,2025-12-12 07:24:58
28494,Aperitivo de café Cerol,6.25,1.0,2025-12-12 07:24:59
8953,Aperitivo de patata con sabor a nata agria y cebolla,1.85,0.175,2025-12-12 07:22:25
33556,Aperitivo de patata sabor crema agria y cebolla Pringles,1.99,0.165,2025-12-12 07:22:22
33555,Aperitivo de patata sabor original Pringles,1.99,0.165,2025-12-12 07:22:22
69245,Apio cortado lavado,1.16,0.21,2025-12-12 07:36:52
69275,Apio verde,1.32,0.66,2025-12-12 07:36:52
35735,Apósitos hidrocoloides adhesivos para ampollas y rozaduras Deliplus surtidos,4.3,1.0,2025-12-12 07:35:58
7894,Apósitos infantiles Tattoo Deliplus,1.3,1.0,2025-12-12 07:36:01
40583,Arcos dentales para higiene interdental Deliplus,1.8,1.0,2025-12-12 07:34:35
13658,Arena para gato aglomerante Nuske perfumada,3.75,5.0,2025-12-12 07:41:56
90080,Arena para gato antibacterias Nuske,1.5,5.0,2025-12-12 07:41:56
90947,Arena para gato de perlas sílice Single,3.55,4.0,2025-12-12 07:41:56
63238,Aritos de surimi a la romana Hacendado ultracongelados,3.3,0.6,2025-12-12 07:41:14
23173,Aritos perro adulto y sénior Compy,8.3,4.0,2025-12-12 07:42:05
19816,Aroma agua de azahar Hacendado,2.0,0.15,2025-12-12 07:42:59
32524,Aroma de vainilla Hacendado,2.0,0.15,2025-12-12 07:42:58
15757,Aros de maíz Hacendado,0.85,0.12,2025-12-12 07:22:31
87786,Arreglo de marisco pelado,9.45,0.45,2025-12-12 07:40:56
3556,Arreglo para arroz al horno,6.0,0.76,2025-12-12 07:26:20
88180,Arreglo para paella con pollo y conejo,6.86,0.94,2025-12-12 07:26:21
3497,"Arreglo para puchero vacuno, cerdo y pollo",7.22,1.11,2025-12-12 07:26:19
5002,Arroz basmati aromático Hacendado,2.2,1.0,2025-12-12 07:22:37
5025,Arroz bomba Hacendado,5.1,1.0,2025-12-12 07:22:36
19866,Arroz campestre con pollo Hacendado ultracongelado,2.0,0.35,2025-12-12 07:29:46
22280,Arroz cocido basmati Sabroz,1.15,0.25,2025-12-12 07:44:29
22281,Arroz cocido integral Sabroz,1.1,0.25,2025-12-12 07:44:29
22279,Arroz cocido redondo Sabroz,1.1,0.25,2025-12-12 07:44:30
68354,Arroz con leche Hacendado,1.35,0.52,2025-12-12 07:45:09
12756,Arroz con verduras para microondas Hacendado ultracongelado,2.0,0.8,2025-12-12 07:29:46
20893,Arroz de pescado Hacendado,4.0,0.28,2025-12-12 07:44:31
22767,Arroz de secreto ibérico con setas Hacendado,3.0,0.28,2025-12-12 07:44:30
60621,Arroz de verduras Hacendado,3.5,0.28,2025-12-12 07:44:31
5184,Arroz integral largo Hacendado,1.65,1.0,2025-12-12 07:22:39
5063,Arroz largo Hacendado,1.35,1.0,2025-12-12 07:22:35
12972,Arroz largo Sabroz,1.1,0.25,2025-12-12 07:22:39
12782,Arroz marinera Hacendado ultracongelado,2.2,0.35,2025-12-12 07:29:46
35541,Arroz negro Hacendado ultracongelado,3.0,0.6,2025-12-12 07:29:45
61302,Arroz para microondas Hacendado ultracongelado,2.0,1.0,2025-12-12 07:29:45
5044,Arroz redondo Hacendado,1.3,1.0,2025-12-12 07:22:35
5042,Arroz redondo J Sendra Hacendado,1.6,1.0,2025-12-12 07:22:37
5000,Arroz redondo La Fallera,1.69,1.0,2025-12-12 07:22:35
52637,Arroz redondo Sabor,2.45,1.0,2025-12-12 07:22:39
86905,Arroz tres delicias Hacendado ultracongelado,2.85,1.0,2025-12-12 07:29:45
5020,Arroz vaporizado Hacendado,1.65,1.0,2025-12-12 07:22:38
5501,Arándanos,3.35,0.225,2025-12-12 07:36:17
5507,Arándanos,6.5,0.5,2025-12-12 07:36:17
34605,Arándanos deshidratados Hacendado,2.3,0.2,2025-12-12 07:22:17
61093,Arándanos enteros Hacendado ultracongelados,2.15,0.3,2025-12-12 07:30:51
18018,Atún claro al natural Hacendado,4.2,0.48,2025-12-12 07:31:10
18055,Atún claro en aceite de girasol Hacendado,4.3,0.48,2025-12-12 07:31:08
18092,Atún claro en aceite de girasol Hacendado,2.7,0.24,2025-12-12 07:31:09
18002,Atún claro en aceite de oliva Hacendado,4.9,0.48,2025-12-12 07:31:09
18071,Atún claro en aceite de oliva Hacendado,1.55,0.111,2025-12-12 07:31:10
18054,Atún claro en aceite de oliva Hacendado,3.7,0.195,2025-12-12 07:31:11
18031,Atún claro en escabeche blanco Hacendado,4.7,0.48,2025-12-12 07:31:10
18086,Atún en aceite de girasol Hacendado,6.5,0.9,2025-12-12 07:31:08
18030,Atún en aceite de oliva Hacendado,7.7,0.9,2025-12-12 07:31:09
18037,Atún en salsa de tomate Hacendado,2.1,0.24,2025-12-12 07:31:11
34164,Avellana natural Hacendado,3.25,0.2,2025-11-22 07:18:20
34025,Avellana tostada Hacendado 0% sal añadida,5.65,0.2,2025-12-12 07:22:02
16807,Avena molida Hacendado,1.15,0.5,2025-12-12 07:27:32
8370,Azafrán hebra Hacendado,1.85,0.0004,2025-12-12 07:20:06
34116,Azafrán molido Hacendado,1.8,0.0004,2025-12-12 07:20:05
19837,Azúcar blanco en sobres Hacendado,1.55,0.35,2025-12-12 07:23:04
19897,Azúcar blanco Hacendado,1.0,1.0,2025-12-12 07:23:04
35649,Azúcar glas Hacendado,2.6,0.5,2025-12-12 07:23:05
22349,Azúcar moreno de caña Hacendado,1.9,1.0,2025-12-12 07:23:04
19832,Azúcar moreno en sobres Hacendado,1.75,0.35,2025-12-12 07:23:05
32525,Azúcar vainillado Hacendado,1.3,0.12,2025-12-12 07:44:01
81204.1,Bacalao a rodajas,43.13,3.75,2025-12-12 07:41:32
81204.2,Bacalao abierto en libro sin cabeza y sin espina,43.13,3.75,2025-12-12 07:41:32
13787,Bacalao ahumado Hacendado en aceite de girasol,3.45,0.11,2025-12-12 07:41:46
87211,Bacalao al punto de sal descongelado,9.0,0.45,2025-12-12 07:41:33
81204.3,Bacalao media pieza a rodajas,20.01,1.74,2025-12-12 07:41:32
81204.4,Bacalao media pieza abierto en libro sin cabeza y sin espina,20.01,1.74,2025-12-12 07:41:33
59163,Bacón ahumado La Selva lonchas,2.3,0.21,2025-12-12 07:28:15
59160,Bacón ahumado sin corteza La Selva,3.0,0.3,2025-12-12 07:28:16
59066,Bacón Hacendado cintas,2.3,0.25,2025-12-12 07:28:15
53500,Bacón Oscar Mayer lonchas,2.4,0.15,2025-12-12 07:28:15
5827,Baguette,0.57,0.25,2025-11-25 07:38:19
83230,Baguette masa madre,0.57,0.25,2025-12-12 07:43:04
82753,Baguette sin gluten,1.95,0.175,2025-12-12 07:43:05
3824,Banana,0.29,0.19,2025-12-12 07:36:03
79673,Bandas adhesivas fijación fuerte color beige Deliplus para cortar,1.5,1.0,2025-12-12 07:35:54
74081,Bandas de cera especial piernas Deliplus piel sensible,1.4,1.0,2025-12-12 07:33:45
74079,Bandas de cera facial Deliplus piel sensible,1.1,1.0,2025-12-12 07:33:44
49632,Bandeja de cartón rectangular Bosque Verde,2.35,4.0,2025-12-12 07:39:19
11611,Bandeja oro Navidad Bosque Verde,1.8,5.0,2025-12-12 07:39:21
86473,Bandeja oro redonda Navidad Bosque Verde,2.5,5.0,2025-12-12 07:39:20
22154,Banderillas dulces Hacendado,1.7,0.345,2025-12-12 07:21:52
