id,name,last_price,unit_size,last_update
69310,Pimiento rojo,1.01,0.35,2025-12-12 07:36:40
35221,Pimiento rojo y verde Hacendado ultracongelado,1.3,0.45,2025-12-12 07:30:58
69312,Pimiento verde,0.81,0.29,2025-12-12 07:36:41
69320,Pimiento verde freír,0.3,0.12,2025-12-12 07:36:40
16103,Pimientos asados en tiras Hacendado,2.4,0.29,2025-12-12 07:31:26
16005,Pimientos del piquillo enteros Hacendado extra,1.45,0.34,2025-12-12 07:31:25
61371,Pimientos del piquillo rellenos de bacalao Hacendado ultracongelados,2.1,0.185,2025-12-12 07:31:02
16117,Pimientos en tiras condimentados Hacendado,1.15,0.29,2025-12-12 07:31:29
16124,Pimientos rojos asados Hacendado en tiras extra,1.35,0.24,2025-12-12 07:31:25
69590,Pimientos semipicantes,1.35,0.25,2025-12-12 07:36:42
69495,Pimientos tricolor,2.11,0.68,2025-12-12 07:36:41
8252,Pincho Mexicano de pollo con varilla,4.84,0.47,2025-12-12 07:26:39
60095,Pincho tortilla de patata con calabacín Listo para Comer,2.1,0.215,2025-12-12 07:44:41
60093,Pincho tortilla de patata con cebolla Listo para Comer,2.1,0.215,2025-12-12 07:44:40
2839,Pinchos de cerdo adobado sin varilla,4.13,0.51,2025-12-12 07:27:21
3456,Pinchos de pollo sin varilla adobados,4.3,0.5,2025-12-12 07:27:24
22529,Pintalabios Creamy Deliplus 201 nude,4.65,1.0,2025-12-12 07:40:17
22530,Pintalabios Creamy Deliplus 202 rosa cálido,4.65,1.0,2025-12-12 07:40:18
41152,Pintalabios Creamy Deliplus 204 rosa pétalo,4.65,1.0,2025-12-12 07:40:18
41258,Pintalabios Creamy Deliplus 207 ciruela,4.65,1.0,2025-12-12 07:40:18
22536,Pintalabios Creamy Deliplus 210 rojo,4.65,1.0,2025-12-12 07:40:19
41151,Pintalabios Creamy Deliplus 212 marrón crema,4.65,1.0,2025-12-12 07:40:19
40055,Pintalabios Creamy Deliplus 213 marsala,4.65,1.0,2025-12-12 07:40:19
8294,Pintalabios Creamy Deliplus 215 malva suave,4.65,1.0,2025-12-12 07:40:20
8299,Pintalabios Creamy Deliplus 218 granate suave,4.65,1.0,2025-12-12 07:40:20
8300,Pintalabios Creamy Deliplus 219 marrón chocolate,4.65,1.0,2025-12-12 07:40:20
20721,Pintalabios Fluido Lipstick Rich Pearly Celestial Night Deliplus rojo,5.0,1.0,2025-11-28 07:43:36
22621,Pintalabios Fluido Mate Deliplus 01 nude beige,4.5,0.0055,2025-12-12 07:40:28
22622,Pintalabios Fluido Mate Deliplus 02 nude rosado,4.5,0.0055,2025-12-12 07:40:28
22623,Pintalabios Fluido Mate Deliplus 03 terracota,4.5,0.0055,2025-12-12 07:40:29
22625,Pintalabios Fluido Mate Deliplus 05 rojo,4.5,0.0055,2025-12-12 07:40:29
23084,Pintalabios Fluido Mate Deliplus 08 rosa palo,4.5,0.0055,2025-12-12 07:40:29
35608,Pintalabios Fluido Mate Deliplus 11 rosa medio,4.5,0.0055,2025-12-12 07:40:30
52429,Pintalabios Fluido Mate Deliplus 12 fucsia,4.5,0.0055,2025-12-12 07:40:30
7892,Pintalabios Fluido Mate Deliplus 13 nude beige,4.5,0.0055,2025-12-12 07:40:30
20726,Pintalabios Lipstick Rich Matte Celestial Night Deliplus rosa nude,5.0,1.0,2025-12-12 07:40:33
14919,Pintalabios Lipstick Terra Deliplus 01 agate rosa medio,5.0,0.0035,2025-12-12 07:40:33
14920,Pintalabios Lipstick Terra Deliplus 02 rosa intenso,5.0,0.0035,2025-12-12 07:40:25
12987,Pintalabios mate 12h Lasting Lips Deliplus 01 rosa nude,5.0,1.0,2025-12-12 07:40:31
12988,Pintalabios mate 12h Lasting Lips Deliplus 02 beige nude,5.0,1.0,2025-12-12 07:40:31
12989,Pintalabios mate 12h Lasting Lips Deliplus 03 medio marrón,5.0,1.0,2025-12-12 07:40:31
12990,Pintalabios mate 12h Lasting Lips Deliplus 04 rosa medio,5.0,1.0,2025-12-12 07:40:31
12992,Pintalabios mate 12h Lasting Lips Deliplus 05 rosa pétalo,5.0,1.0,2025-12-12 07:40:32
12993,Pintalabios mate 12h Lasting Lips Deliplus 06 malva,5.0,1.0,2025-12-12 07:40:32
12994,Pintalabios mate 12h Lasting Lips Deliplus 07 fucsia,5.0,1.0,2025-12-12 07:40:32
12995,Pintalabios mate 12h Lasting Lips Deliplus 08 rojo,5.0,1.0,2025-12-12 07:40:33
23540,Pintalabios mate Deliplus 101 nude,4.5,0.004,2025-12-12 07:40:26
23541,Pintalabios Mate Deliplus 102 caramelo,4.5,0.004,2025-12-12 07:40:27
60929,Pintalabios Mate Deliplus 107 caldera,4.5,0.004,2025-12-12 07:40:27
60933,Pintalabios Mate Deliplus 111 marrón,4.5,0.004,2025-12-12 07:40:27
8303,Pintalabios Mate Deliplus 114 rosa medio,4.5,0.004,2025-12-12 07:40:28
8301,Pintalabios Mate Deliplus 116 rojo intenso,4.5,0.004,2025-12-12 07:40:28
78071,Pinza de cejas Deliplus oblicua,2.0,1.0,2025-12-12 07:33:47
78073,Pinza de cejas Deliplus recta,2.0,1.0,2025-12-12 07:33:48
9900,Pinzas de ropa Bosque Verde,1.5,24.0,2025-12-12 07:39:41
15967,Piparra Hacendado,2.8,0.29,2025-12-12 07:21:56
34095,Pipas calabaza tostadas Hacendado aguasal,1.55,0.125,2025-12-12 07:22:10
34188,Pipas de calabaza natural Hacendado peladas,1.7,0.15,2025-12-12 07:22:05
34145,Pipas de girasol fritas Hacendado peladas,1.1,0.2,2025-12-12 07:22:07
34043,Pipas girasol barbacoa Hacendado,1.35,0.2,2025-12-12 07:22:08
34193,Pipas girasol naturales Hacendado peladas,1.24,0.2,2025-12-12 07:22:09
23059,Pipas girasol tostadas Hacendado 0% sal añadida,1.3,0.2,2025-12-12 07:22:10
34078,Pipas girasol tostadas Hacendado gigante aguasal,1.2,0.2,2025-12-12 07:22:00
34079,Pipas girasol tostadas Hacendado gigante con sal,1.2,0.2,2025-12-12 07:21:59
22249,Piquitos bajos en sal Hacendado con orégano y tomillo,1.23,0.25,2025-12-12 07:43:40
82222,Piquitos con salvado San Roque,0.9,0.142,2025-12-12 07:43:42
52455,Piruleta de chocolate con leche Hacendado Navidad,1.7,0.035,2025-12-12 07:23:36
34262,Pistacho natural Hacendado pelado,2.95,0.1,2025-12-12 07:22:11
86190,Pistacho tostado Hacendado 0% sal añadida,3.65,0.25,2025-12-12 07:21:59
86202,Pistacho tostado Hacendado con sal,3.65,0.25,2025-12-12 07:21:59
35653,Pisto de verduras Hacendado ultracongelado,2.1,0.45,2025-12-12 07:31:02
63628,Pizza 4 quesos familiar Hacendado,3.4,0.58,2025-12-12 07:44:14
63580,Pizza 4 quesos Hacendado,2.9,0.41,2025-12-12 07:44:14
63592,Pizza 4 quesos Hacendado,2.9,0.42,2025-12-12 07:44:14
63623,Pizza 4 quesos sin gluten y sin lactosa Hacendado ultracongelada,3.1,0.41,2025-12-12 07:44:22
63643,Pizza Americana Hacendado ultracongelada,3.5,0.54,2025-12-12 07:44:21
63501,Pizza atún Hacendado ultracongelada,2.6,0.39,2025-12-12 07:44:21
63582,Pizza atún y bacón Hacendado,2.9,0.415,2025-12-12 07:44:16
56647,Pizza atún y bacón Hacendado,2.9,0.44,2025-12-12 07:44:16
63629,Pizza barbacoa familiar Hacendado,3.4,0.6,2025-12-12 07:44:13
63613,Pizza barbacoa Hacendado,2.5,0.415,2025-12-12 07:44:13
60685,Pizza barbacoa Hacendado,2.9,0.44,2025-12-12 07:44:14
63559,Pizza boloñesa Hacendado ultracongelada,2.6,0.4,2025-12-12 07:44:20
22549,Pizza Calzone con jamón cocido y queso Hacendado,3.5,0.4,2025-12-12 07:44:18
63632,Pizza carbonara familiar Hacendado,3.4,0.6,2025-12-12 07:44:15
63653,Pizza carbonara Hacendado,2.9,0.43,2025-12-12 07:44:15
12083,Pizza carnívora Hacendado,3.4,0.6,2025-12-12 07:44:19
67947,Pizza Formaggi Hacendado 4 quesos,3.9,0.4,2025-12-12 07:44:19
14246,Pizza Frankfurt Hacendado,2.9,0.42,2025-12-12 07:44:19
63627,Pizza jamón y queso familiar Hacendado,3.4,0.6,2025-12-12 07:44:12
63581,Pizza jamón y queso Hacendado,2.5,0.415,2025-12-12 07:44:12
63593,Pizza jamón y queso Hacendado,2.9,0.44,2025-12-12 07:44:13
63514,Pizza jamón y queso sin gluten y sin lactosa Hacendado,3.2,0.42,2025-12-12 07:44:18
63585,Pizza margarita Hacendado,2.2,0.34,2025-12-12 07:44:17
63340,Pizza masa fina 4 quesos Hacendado ultracongelada,2.5,0.39,2025-12-12 07:44:21
22649,Pizza masa fina Barbacoa Hacendado ultracongelada,2.5,0.39,2025-12-12 07:44:22
63339,Pizza masa fina jamón Hacendado ultracongelada,2.5,0.4,2025-12-12 07:44:21
22648,Pizza Pepperoni barbacoa Hacendado ultracongelada,3.5,0.54,2025-12-12 07:44:20
63556,Pizza pepperoni Hacendado,2.9,0.41,2025-12-12 07:44:16
63529,Pizza pollo Hacendado,2.9,0.43,2025-12-12 07:44:17
63645,Pizza pollo y bacón Hacendado,2.9,0.42,2025-12-12 07:44:18
22343,Pizza Prosciutto Hacendado jamón y queso,3.9,0.4,2025-12-12 07:44:18
63503,Pizza romana Hacendado con champiñones salteados,2.9,0.43,2025-12-12 07:44:17
63551,Pizza serrana Hacendado,2.9,0.4,2025-12-12 07:44:15
13943,"Pizza Truffata con queso, champiñones y trufa Hacendado ultracongelada",2.9,0.4,2025-12-12 07:44:22
63597,Pizzas tomate y queso Hacendado ultracongeladas,2.4,0.57,2025-12-12 07:44:20
3076,Piña,4.08,2.09,2025-12-12 07:36:13
33440,Piña deshidratada Hacendado,1.35,0.05,2025-12-12 07:22:30
15203,Piña en su jugo Hacendado rodajas,2.5,0.681,2025-12-12 07:31:32
15220,Piña en su jugo Hacendado rodajas,2.1,0.822,2025-12-12 07:31:33
3024,Piña natural a rodajas,3.48,0.58,2025-12-12 07:36:14
60869,Piñones Hacendado,3.02,0.07,2025-12-12 07:20:15
86843,Piñones Hacendado,5.9,0.15,2025-12-12 07:20:15
52889,Placas para canelones El Pavo,1.35,0.125,2025-12-12 07:23:03
6856,Placas para lasaña precocidas El Pavo,1.65,0.2,2025-12-12 07:23:03
44404,Planchado fácil Bosque Verde,2.2,0.75,2025-12-12 07:38:01
22634,Plato decoración poinsettia Navidad Bosque Verde,2.8,10.0,2025-12-12 07:39:20
23187,Plato llano biodegradable Bosque Verde,1.6,15.0,2025-12-12 07:39:16
23188,Plato postre biodegradable Bosque Verde,1.45,15.0,2025-12-12 07:39:16
22635,Plato postre decorado Navidad Bosque Verde,2.55,10.0,2025-12-12 07:39:21
22633,Plato rojo Navidad Bosque Verde,2.8,10.0,2025-12-12 07:39:20
8999,Plumero atrapa polvo Bosque Verde,2.0,1.0,2025-12-12 07:39:45
71586,Plumero de avestruz extensible Bosque Verde,4.95,1.0,2025-12-12 07:39:44
3819,Plátano de Canarias IGP,0.38,0.16,2025-12-12 07:36:03
3132,Plátano macho,0.78,0.27,2025-12-12 07:36:04
13237,Poke salmón,5.5,0.4,2025-12-12 07:44:09
56084,Pollo 97% relleno La Carloteña asado al horno lonchas,2.4,0.15,2025-12-12 07:28:06
8958,Pollo adobado y verduras,3.17,0.46,2025-12-12 07:26:39
4498,Pollo al curry Hacendado con arroz basmati,2.85,0.28,2025-12-12 07:44:30
13706,Pollo asado Hacendado,6.88,1.25,2025-12-12 07:44:31
13707,Pollo asado troceado Hacendado,8.06,1.25,2025-12-12 07:44:36
2782,Pollo certificado entero alimentado con un 50% de maíz,9.25,1.85,2025-12-12 07:26:36
4267,Pollo churrasco,4.31,0.98,2025-12-12 07:26:37
2781,Pollo entero,6.65,1.9,2025-12-12 07:26:33
60306,Pollo marinado rebozado Crispy American Style Hacendado ultracongelado,4.9,0.5,2025-12-12 07:30:36
13236,Pollo teriyaki,5.0,0.3,2025-12-12 07:44:04
52974,Polvo Compacto 24H Long Lasting Deliplus 02 beige rosado,6.0,0.01,2025-12-12 07:40:10
52975,Polvo Compacto 24H Long Lasting Deliplus 03 dorado,6.0,0.01,2025-12-12 07:40:10
52976,Polvo Compacto 24H Long Lasting Deliplus 04 dorado oscuro,6.0,0.01,2025-12-12 07:40:10
8315,Polvo Compacto 24H Long Lasting Deliplus 05 bronceado,6.0,0.01,2025-12-12 07:40:10
80427,Polvo compacto Matificante Deliplus,5.4,0.009,2025-12-12 07:40:09
13026,Polvo compacto perfeccionador efecto seda Deliplus 100 beige claro,6.0,0.01,2025-12-12 07:40:11
13029,Polvo compacto perfeccionador efecto seda Deliplus 200 beige rosado,6.0,0.01,2025-12-12 07:40:11
13030,Polvo compacto perfeccionador efecto seda Deliplus 210 almendra,6.0,0.01,2025-12-12 07:40:11
13033,Polvo compacto perfeccionador efecto seda Deliplus 300 cappuccino,6.0,0.01,2025-12-12 07:40:12
80433,Polvo compacto Sol Deliplus claro,7.5,0.022,2025-12-12 07:40:08
80434,Polvo compacto Sol Deliplus oscuro,7.5,0.022,2025-12-12 07:40:09
80428,Polvo suelto Translúcido Deliplus 01,5.5,0.005,2025-12-12 07:40:09
85649,Polvoroncito de chocolate La Muralla,0.21,0.035,2025-12-12 07:42:43
85708,Polvorón de almendra La Muralla,0.24,0.04,2025-12-12 07:42:42
35595,Polvos de talco Deliplus,1.8,0.2,2025-12-12 07:24:23
11933,Polvos voluminizador para el cabello Volum Fix Deliplus mate fijación 4,3.95,0.01,2025-12-12 07:32:55
79344,Pomada del pañal sin perfume Deliplus,2.75,0.1,2025-12-12 07:24:20
3202,Pomelo,0.51,0.26,2025-12-12 07:36:11
62049,Porciones de bacalao sin piel MareDeus ultracongeladas,6.4,,2025-12-12 07:41:10
12495,Porciones de Chocolate negro 72% cacao extrafino Hacendado,3.65,0.2,2025-12-12 07:23:19
12493,Porciones de Chocolate negro 85% cacao extrafino Hacendado,3.8,0.2,2025-12-12 07:23:21
87200,Porciones de merluza,8.44,0.313,2025-11-19 19:50:50
87240,Porciones de merluza del Cabo,9.1,0.35,2025-12-12 07:41:31
62103,Porciones de merluza del Cabo sin piel Hacendado ultracongeladas,4.9,,2025-12-12 07:41:11
87181,Porciones de rape negro sin piel descongelado,15.2,0.38,2025-12-12 07:41:38
15137,Porras Hacendado congeladas,2.0,0.24,2025-12-12 07:30:49
71055,Posavajillas Bosque Verde,1.35,1.0,2025-12-12 07:38:07
52564,Postre 3 chocolates Hacendado,2.95,0.18,2025-12-12 07:45:13
19947,Postre Capricho Hacendado de yema de huevo,1.7,1.2,2025-12-12 07:45:14
14275,Postre caramelo salado Hacendado,2.95,0.18,2025-12-12 07:45:15
22981,Postre de coco Natural Alpro,2.55,0.35,2025-12-12 07:45:17
15086,Postre de manzana Jamar,1.9,0.71,2025-12-12 07:31:35
20200,Postre de soja Hacendado natural,1.2,0.4,2025-12-12 07:45:16
35466,Postre de soja Hacendado sabor chocolate,1.55,0.4,2025-12-12 07:45:15
13446,Postre de soja Hacendado sabor vainilla,1.55,0.4,2025-12-12 07:45:15
8179,Postre de soja sabor arándanos Alpro,2.25,0.4,2025-12-12 07:45:17
13917,Postre de soja sabor lima limón Alpro,2.25,0.4,2025-12-12 07:45:17
21369,Postre de soja sabor mango Alpro sin azúcares añadidos,2.55,0.4,2025-12-12 07:45:16
52513,Postre de soja sabor Natural con coco Alpro,2.25,0.4,2025-12-12 07:45:16
21073,Postre lácteo con arándanos +Proteínas Hacendado 0% m.g 10 g proteínas,1.55,0.48,2025-12-12 07:45:19
20996,Postre lácteo con fresa +Proteínas Hacendado 0% m.g 10 g proteínas,1.55,0.48,2025-12-12 07:45:18
86087,Postre lácteo con fruta Hacendado 0% m.g 0% sin azúcares añadidos,2.0,1.0,2025-12-12 07:45:19
21151,Postre lácteo con puré mango y maracuya +Proteínas Hacendado 0% m.g 10 g proteínas,1.55,0.48,2025-12-12 07:45:21
20830,Postre lácteo cremoso natural edulcorado Hacendado 0% m.g 0% sin azúcares añadidos,1.4,0.75,2025-12-12 07:45:18
22444,Postre lácteo infantil de cereales y miel Hacendado +12 meses,0.95,0.1,2025-12-12 07:45:44
22442,Postre lácteo infantil de fresa y plátano Hacendado +8 meses,0.95,0.1,2025-12-12 07:45:44
60400,Postre lácteo infantil de galleta Hacendado +8 meses,0.95,0.1,2025-12-12 07:45:44
21256,Postre lácteo natural +Proteínas Hacendado 0% m.g 10 g proteínas,1.4,0.5,2025-12-12 07:45:21
20908,Postre lácteo natural +Proteínas Hacendado 0% m.g 12 g proteínas,1.4,0.48,2025-12-12 07:45:22
52855,Postre lácteo sabor coco +Proteínas Hacendado 0% m.g 10 g proteínas,1.55,0.48,2025-12-12 07:45:22
20849,Postre lácteo sin lactosa cremoso natural azucarado Hacendado,1.55,0.5,2025-12-12 07:45:38
20164,Postre lácteo sin lactosa natural Hacendado 0% m.g 0% azúcares añadidos,1.35,0.5,2025-12-12 07:45:21
22799,Postre lácteo sin lactosa sabor fresa Hacendado,1.45,0.5,2025-12-12 07:45:42
35940,Povidona yodada 10% Deliplus,2.15,0.125,2025-12-12 07:35:55
40258,Prebase corrector Primer Deliplus 02 tono melocotón,5.5,0.025,2025-12-12 07:40:00
15747,Prebase de maquillaje matificante Primer,5.5,0.025,2025-12-12 07:39:59
14922,Prebase facial Primer Terra Deliplus jade,7.0,0.026,2025-12-12 07:40:02
20749,Prebase facial Radiance Primer Celestial Night Deliplus con microcápsulas perladas,6.0,0.02,2025-12-12 07:40:03
22932,Preparado crujiente Hacendado,1.6,0.4,2025-12-12 07:43:35
2867,Preparado de carne picada cerdo,2.75,0.5,2025-12-12 07:27:11
14343,Preparado de carne picada cerdo sabor chorizo,3.85,0.5,2025-12-12 07:27:13
35774,Preparado de carne picada pollo,3.95,0.5,2025-12-12 07:27:12
2868,Preparado de carne picada vacuno,5.5,0.5,2025-12-12 07:27:11
3454,Preparado de carne picada vacuno,10.8,1.0,2025-12-12 07:27:11
52776,Preparado de carne picada vacuno,5.6,0.4,2025-12-12 07:27:12
2869,Preparado de carne picada vacuno y cerdo,4.3,0.5,2025-12-12 07:27:10
3453,Preparado de carne picada vacuno y cerdo,8.4,1.0,2025-12-12 07:27:10
62048,Preparado de paella y sopa Hacendado ultracongelado,4.1,,2025-12-12 07:40:55
69387,Preparado de verdura para cocido,2.15,1.0,2025-12-12 07:36:52
69433,Preparado de verduras para sofreír cortado y lavado,2.4,0.4,2025-12-12 07:36:56
32358,Preparado en polvo cuajada azucarada Royal sabor lácteo,1.45,0.048,2025-12-12 07:42:56
32045,Preparado en polvo flan Hacendado,1.4,0.19,2025-12-12 07:42:57
32002,Preparado en polvo flan Royal,1.8,0.186,2025-12-12 07:42:56
32030,Preparado en polvo flanes y natillas Maizena Potax,1.75,0.192,2025-12-12 07:42:57
32369,Preparado en polvo gelatina arándano Hacendado 0% azúcar,2.0,0.031,2025-12-12 07:42:59
32361,Preparado en polvo gelatina fresa Hacendado,1.5,0.17,2025-12-12 07:42:58
11601,Preparado en polvo instantáneo para crepes Hacendado,2.0,0.17,2025-12-12 07:43:00
32329,Preparado en polvo natillas Hacendado,1.4,0.089,2025-12-12 07:42:58
9054,Preparado lácteo cereales al cacao Peques 3 Puleva,2.0,0.6,2025-11-27 07:34:09
9190,Preparado lácteo con cacao y cereales Hacendado +1 año,2.3,1.2,2025-12-12 07:37:38
9398,Preparado lácteo con cereales crecimiento Hacendado +1 año,9.6,6.0,2025-12-12 07:37:37
9397,Preparado lácteo con cereales crecimiento Hacendado +1 año,1.6,1.0,2025-12-12 07:37:38
9057,Preparado lácteo con cereales crecimiento Peques 3 Puleva,11.94,6.0,2025-12-12 07:37:36
9034,Preparado lácteo con cereales crecimiento Peques 3 Puleva,1.99,1.0,2025-12-12 07:37:37
20321,Preparado lácteo con cereales y frutas Peques 3 Puleva,2.0,0.6,2025-12-12 07:24:13
9187,Preparado lácteo crecimiento Hacendado +1 año,8.4,6.0,2025-12-12 07:37:37
9188,Preparado lácteo crecimiento Hacendado +1 año,1.4,1.0,2025-12-12 07:37:37
9049,Preparado lácteo crecimiento Peques 3 Puleva,11.94,6.0,2025-12-12 07:37:36
9040,Preparado lácteo crecimiento Peques 3 Puleva,1.99,1.0,2025-12-12 07:37:36
19726,Preparado para ahumar Hacendado,3.3,0.75,2025-12-12 07:20:01
23646,Preparado para pizzas Hacendado,1.45,1.0,2025-12-12 07:42:52
29017,Preparado para repostería con impulsor incorporado Hacendado,1.05,1.0,2025-12-12 07:42:50
80292,Preparado para repostería y panificación Hacendado,2.7,1.0,2025-12-12 07:42:53
5840,Presa de bellota ibérica La Hacienda del Ibérico,29.4,0.49,2025-12-12 07:28:44
4915,Presa de cerdo ibérico,8.91,0.33,2025-12-12 07:26:53
77427,Preservativos natural Durex,7.25,1.0,2025-12-12 07:36:02
11606,Preservativos natural On,3.0,1.0,2025-12-12 07:36:02
11607,Preservativos sensitive On,3.2,1.0,2025-12-12 07:36:03
77441,Preservativos sensitivo suave Durex,8.25,1.0,2025-12-12 07:36:02
47377,Protector cama tamaño 60 x 90 cm Deliplus,8.5,1.0,2025-12-12 07:34:54
40413,Protector labial Deliplus FPS 15,1.5,1.0,2025-12-12 07:35:43
60608,Protector solar infantil pediátrico Sun Med FPS 50+,7.5,0.25,2025-12-12 07:35:43
44317,Protector térmico cabello Termo Protect Deliplus,3.0,0.2,2025-12-12 07:32:53
22712,Protectores para los oídos de espuma Moldex,1.7,1.0,2025-12-12 07:35:59
47554,Protegeslip Cotton flexiform Carefree regular + tanga,1.95,1.0,2025-12-12 07:34:47
47480,Protegeslip de incontinencia Deliplus pequeño,3.1,1.0,2025-12-12 07:34:48
47350,Protegeslip maxi Deliplus Cotton,1.8,1.0,2025-12-12 07:34:49
47352,Protegeslip maxi Deliplus Dry,2.5,1.0,2025-12-12 07:34:49
47387,Protegeslip maxi Deliplus Suave,2.25,1.0,2025-12-12 07:34:46
47390,Protegeslip micro Deliplus Fresh,2.0,1.0,2025-12-12 07:34:48
47349,Protegeslip normal Deliplus Cotton,1.7,1.0,2025-12-12 07:34:49
47351,Protegeslip normal Deliplus Dry,2.1,1.0,2025-12-12 07:34:48
47385,Protegeslip normal Deliplus Suave,1.85,1.0,2025-12-12 07:34:45
13954,Protegeslip normal Evax,3.5,1.0,2025-12-12 07:34:46
47386,Protegeslip normal plegado Deliplus Suave,1.1,1.0,2025-12-12 07:34:46
47392,Protegeslip tanga Deliplus Fresh,1.25,1.0,2025-12-12 07:34:47
47391,Protegeslip ultrafino Deliplus Fresh,1.25,1.0,2025-12-12 07:34:47
47389,Protegeslip y compresa 2 en 1 Deliplus Suave,1.65,1.0,2025-12-12 07:34:45
9790,Pudding sabor café +Proteínas Hacendado 12 g proteínas,1.95,0.48,2025-11-20 19:56:58
69411,Puerros,2.52,0.9,2025-12-12 07:36:50
68408,Puerros,2.16,0.45,2025-12-12 07:36:50
82850,Pulpo cocido,12.6,0.35,2025-12-12 07:41:35
24208,Pulpo crudo Hacendado congelado,17.95,1.0,2025-12-12 07:41:21
24291,Puntilla de la Índia Hacendado congelada,4.7,,2025-12-12 07:41:21
23264,Puré de patatas Hacendado en copos,2.0,0.5,2025-12-12 07:31:40
50929,Queso Arzúa-Ulloa de vaca Punteiro,7.45,0.78,2025-12-12 07:29:08
51627,Queso azul de vaca Hacendado,2.45,0.18,2025-12-12 07:29:41
50959,Queso añejo de oveja al romero Hacendado,5.18,0.27,2025-12-12 07:29:08
50975,Queso añejo fuerte de oveja Hacendado,6.04,0.33,2025-12-12 07:29:06
5548,Queso añejo ibérico mezcla Hacendado cortado en cuñitas,6.08,0.32,2025-12-12 07:29:10
50972,Queso añejo picante mezcla Hacendado,4.43,0.25,2025-11-11 07:28:32
50973,Queso añejo seco de oveja Hacendado,4.01,0.23,2025-12-10 19:42:08
50952,Queso añejo tostado mezcla Hacendado,6.19,0.37,2025-12-12 07:29:10
5522,Queso blando mezcla Hacendado,2.24,0.14,2025-12-12 07:29:42
50619,Queso brie marcillat de vaca Plaisir de Roy,1.65,0.2,2025-12-12 07:29:41
51621,Queso camembert de vaca Marcillat,2.0,0.24,2025-12-12 07:29:40
51630,Queso curado cheddar Hacendado,3.3,0.3,2025-12-12 07:29:08
19865,Queso curado de oveja con jalapeño Hacendado,5.54,0.26,2025-12-12 07:29:11
50589,Queso curado DOP manchego de oveja Hacendado,5.43,0.27,2025-12-12 07:29:09
11682,Queso curado mezcla afrutado Hacendado cortado en cuñitas,4.83,0.33,2025-12-12 07:29:11
4883,Queso curado mezcla con trufa Hacendado,6.04,0.27,2025-12-12 07:29:10
50968,Queso curado mezcla Hacendado,18.06,1.63,2025-12-12 07:29:03
50965,Queso curado mezcla Hacendado,4.67,0.41,2025-12-12 07:29:04
50967,Queso curado mezcla Hacendado,12.31,1.09,2025-12-12 07:29:04
50966,Queso curado mezcla Hacendado cortado en cuñitas,4.69,0.33,2025-12-12 07:29:04
50994,Queso curado mezcla madurado en madera Hacendado,3.87,0.26,2025-12-12 07:29:10
51111,Queso curado y cheddar Hacendado en dados,1.15,0.125,2025-12-12 07:29:05
19862,Queso de cabra Montesinos,2.35,0.2,2025-12-12 07:29:44
23561,Queso emmental de vaca Hacendado,3.0,0.35,2025-12-12 07:29:14
51151,Queso en polvo especial pasta mezcla Hacendado,1.3,0.15,2025-12-12 07:29:24
51146,Queso en polvo grana padano Hacendado,1.7,0.1,2025-12-12 07:29:24
52405,Queso en porciones Hacendado,2.1,0.375,2025-12-12 07:29:26
51232,Queso en porciones light Hacendado,1.65,0.25,2025-12-12 07:29:26
51504,Queso en porciones mini Babybel,3.8,0.16,2025-12-12 07:29:26
51197,Queso feta mezcla Hacendado en dados,2.4,0.37,2025-12-12 07:29:33
51043,Queso fresco 0% m.g de vaca Burgo de Arias,3.3,0.216,2025-12-12 07:29:37
51071,Queso fresco batido desnatado 0% m.g Hacendado,1.1,0.5,2025-12-12 07:29:35
52409,Queso fresco Burgos desnatado 0% m.g Hacendado,1.15,0.25,2025-12-12 07:29:33
52407,Queso fresco Burgos desnatado 0% m.g Hacendado,2.05,0.5,2025-12-12 07:29:38
52406,Queso fresco Burgos natural Hacendado,2.05,0.5,2025-12-12 07:29:32
52408,Queso fresco Burgos natural Hacendado,1.15,0.25,2025-12-12 07:29:32
52411,Queso fresco Burgos sin lactosa Hacendado,1.9,0.25,2025-12-12 07:29:37
60963,Queso fresco cottage semidesnatado de vaca Hacendado,1.35,0.2,2025-12-12 07:29:39
51194,Queso fresco de cabra Hacendado,2.8,0.25,2025-12-12 07:29:34
50386,Queso fresco de cabra Hacendado,2.97,0.25,2025-12-12 07:29:39
51044,Queso fresco de vaca Burgo de Arias,3.3,0.216,2025-12-12 07:29:34
51191,Queso fresco de vaca Hacendado,1.7,0.25,2025-12-12 07:29:35
51192,Queso fresco light de vaca Hacendado,2.2,0.25,2025-12-12 07:29:36
51072,Queso fresco mascarpone de vaca Hacendado,2.75,0.25,2025-12-12 07:29:35
50160,Queso fresco mascarpone de vaca Hacendado,5.0,0.5,2025-12-12 07:29:36
50401,Queso fresco servilleta tradicional de vaca Hacendado,2.45,0.25,2025-12-12 07:29:33
51210,Queso fresco tronchón mezcla Hacendado,2.95,0.25,2025-12-12 07:29:39
51068,Queso fundido con palitos La vaca que ríe,2.59,0.14,2025-12-12 07:29:26
50613,Queso gorgonzola de vaca Hacendado,2.13,0.17,2025-12-12 07:29:42
23037,Queso grana padano Hacendado en escamas,2.7,0.1,2025-12-12 07:29:09
50008,Queso grana padano Zanetti,3.91,0.23,2025-12-12 07:29:05
8180,Queso lonchas cheddar de vaca Hacendado,2.0,0.2,2025-12-12 07:29:21
50545,Queso lonchas cremoso de vaca Hacendado,3.0,0.3,2025-12-12 07:29:18
50546,Queso lonchas cremoso light de vaca Hacendado,3.0,0.3,2025-12-12 07:29:19
50153,Queso lonchas de cabra Hacendado,3.15,0.22,2025-12-12 07:29:20
50151,Queso lonchas de oveja Entrepinares,2.89,0.21,2025-12-12 07:29:22
50459,Queso lonchas edam de vaca Holland Corona,2.3,0.3,2025-12-12 07:29:21
60710,Queso lonchas emmental de vaca Hacendado,2.25,0.2,2025-12-12 07:29:22
51198,Queso lonchas fundido burger mezcla Hacendado,1.9,0.3,2025-12-12 07:29:23
51182,Queso lonchas fundido suave mezcla Hacendado,2.35,0.555,2025-12-12 07:29:21
50371,Queso lonchas fundido sándwich mezcla Hacendado,1.3,0.2,2025-12-12 07:29:19
50654,Queso lonchas gouda de vaca Hacendado,2.45,0.3,2025-12-12 07:29:20
51126,Queso lonchas mozzarella de vaca Hacendado,1.8,0.2,2025-12-12 07:29:21
50148,Queso lonchas semicurado mezcla Entrepinares,2.57,0.21,2025-12-12 07:29:19
12846,Queso lonchas sin lactosa de vaca Hacendado,2.6,0.2,2025-12-12 07:29:22
50543,Queso lonchas tierno de vaca Entrepinares,2.55,0.3,2025-12-12 07:29:20
50385,Queso lonchas tierno mezcla Entrepinares,2.49,0.25,2025-12-12 07:29:18
5515,Queso Morbier de vaca Hacendado,4.09,0.2,2025-12-12 07:29:11
4929,Queso precortado de cabra Hacendado,2.65,0.2,2025-12-12 07:29:43
4848,Queso provolone de vaca Hacendado,2.6,0.2,2025-12-12 07:29:43
15300,Queso raclette ahumada de vaca Richesmonts,2.95,0.2,2025-12-12 07:29:44
51234,Queso rallado 4 quesos Hacendado,1.83,0.18,2025-12-12 07:29:24
22216,Queso rallado emmental gratinar Hacendado,1.73,0.2,2025-12-12 07:29:23
23622,Queso rallado especial fundir mezcla Hacendado,2.3,0.4,2025-12-12 07:29:25
